Type,Title,Time Stamp,Score,Id,Url,Num Comments,Post Text,Post Id,Comment Id,Comment Text
comment,,1712696291.0,1,,,,,nc9090,kytraxo,"You sir are a genius, who would have thought that the old good trusty soviet way of fixing things by hitting them to death would work, I salute you, you saved me"
comment,,1712835566.0,1,,,,,nc9090,kz28fog,Has any of you who fixed the headphones this way gotten a somewhat permanent result? I got them to work a few times this way but had to open them up and repeat the process again and again until they stopped working completely.
comment,,1713008237.0,1,,,,,nc9090,kzdbyv7,ok... my headphones wouldn't switch on. I found this post and just gave it a smack on the left headset and it started working again. Very funny!! 🤣🤣 Thank you.
comment,,1713566988.0,1,,,,,nc9090,l0d9ish,"Hi all,


same problem here. Pressing and protecting wires didn't help. 
Mainboard the top two wires on the right side had a bad connection so i resoldered them. I got a normal flashing blue light but some minutes later dead again and i was not able to fix it...
Are there any news about reflowing the chip and is there a picture of the chip on the board?
Right now im close to giving up. :-/"
comment,,1713689254.0,1,,,,,nc9090,l0kl2sh,AMAZING. A little knock fixed the issue. If it comes back I do the reopening trick. Thanks!
comment,,1714088310.0,1,,,,,nc9090,l19u7if,Just wanted to pop in and say thank you for this post. My headset just experienced this after owning them for 5 years and the tips here saved me from a lot of anxiety.
comment,,1715377147.0,1,,,,,nc9090,l3hpbq2,"i’m having this exact issue with the WH XB900N, could it be the same type of issue? i posted in r/sony but its gotta be manually approved. i have it disassembled but obviously it looks a little different and i’m not quite sure what to look for"
comment,,1715496304.0,1,,,,,nc9090,l3oh62z,Just fixed my in laws pair. Big brownie points earned thanks OP!
comment,,1715523194.0,1,,,,,nc9090,l3pnsg4,Thanks a lot. I would have had to buy an XM5 for 25k INR. May you get a hot spouse.
comment,,1716119661.0,1,,,,,nc9090,l4q2prb,thanks alot man! you're a real life saver. had the same problem with my. My bottle of water was leaking in my backpack so it got in touch with some water. Managed to disassemble it according to the video and put some isolation tape on and disconnected the battery for a while. works perfectly again!
comment,,1716204154.0,1,,,,,nc9090,l4uzj8e,This post is a lifesaver. I did exactly what this dude shows in the photos (moved around the wires so they don't touch) and my headset powered one without a hitch
comment,,1717012589.0,1,,,,,nc9090,l6811vm,---
comment,,1717362157.0,1,,,,,nc9090,l6ti6ba,"I thought it was from the battery and i replace it on the right side, but, after reading this post, I oppened the left side and just touch the 2 wires once you open it and it automaticaly worked... thanks man, just saved my phones!!!! And now I have a spare battery 🤣🤣🤣🤣🤣🤣"
comment,,1718044140.0,1,,,,,nc9090,l8006ba,"This helped me a lot, now my headset is working again too:)"
comment,,1718994782.0,1,,,,,nc9090,l9nij8b,"Just fixed mine as well!  I followed all the steps and for me it was on the left. Moving the wires didn’t help, but putting pressure on the left side of the circuit board did. So I took a small piece of foam off a pool noodle and super glued that to the back of the ear cup plastic where it would make contact with that left side of the circuit board and so far so good. It has been working for an hour. 🥳🤞🏻"
comment,,1720261038.0,1,,,,,nc9090,lbvhz30,Man I mean Dayyum that knocking on the left side literally worked for me 🙌🏻
comment,,1720376664.0,1,,,,,nc9090,lc2p69e,"I was about to throw mines away, and then I red this. I just knocked 3 times the letf plastic, and they worked!!!! I can't believe that sony headphones function depends on knocking them. Thanks a lot!!!

UPDATE: they stoped working, so I followed instructions and opened them. I just placed very thin layers of blu-tack to isolate some wires from others. Didnt know what I was doing really, but good result. They work now steady."
comment,,1720436875.0,1,,,,,nc9090,lc6beuz,Dont know exactly what i did but i opened them played a bit with the cables put some foam in it and now it works! :)
comment,,1720596232.0,1,,,,,nc9090,lch7znj,thank you so much!
comment,,1721227121.0,1,,,,,nc9090,ldm78hh,Same issue  can anybody help
comment,,1721478367.0,1,,,,,nc9090,le2mwy7,"Hi, this post may be old, but it has helped me fixing my headphones!

Yesterday, I wanted to use my headphones, but they didn't turn on. I couldn't even reset them. But after your fix, I was surprised to see that they actually worked!"
comment,,1721503852.0,1,,,,,nc9090,le4gv1y,"This worked! With the added ""put pressure on the circuit board"" using a small cotton swab, they're alive an kicking again. Thx!"
comment,,1721816941.0,1,,,,,nc9090,leoqlyc,"https://preview.redd.it/dqvrliur1ged1.jpeg?width=2250&format=pjpg&auto=webp&s=aaff2bc06c4192fe78cacf023ccce55a25c25fc1

My mx3 already had these on when i opened them. But they still don't work"
comment,,1721817596.0,1,,,,,nc9090,leorp95,"removed the tape, re ordered the wires and yes 2 wires were touching each other. After separating and putting the tape back, it now works

https://preview.redd.it/zwxevf0q3ged1.jpeg?width=2250&format=pjpg&auto=webp&s=a2d67075fcc9c714e6a8e4f09779687a9a774983"
comment,,1723179809.0,1,,,,,nc9090,lh8a7sp,Putting something in there to put pressure on the ribbon cable just resolved it for me.
comment,,1723369198.0,1,,,,,nc9090,lhkeiz6,"Another successful quick fix. Added foam that press on left circuit board. Tried pressing thumb on the board first - suddenly the power button (and full headset) works again. Just added foam patch and screwed it tight, still works. Fingers crossed it will hold over time.

(Failure cause: dropped from head height to floor.
Symptom: Would charge with red light, not starting with power button, reacting to nfc but not connecting or starting.
First tries, unsuccessful: separating wires, detatching and reattatching internal contact.)

Huge thanks to OP and contributors. Co-op problem solving ftw. :) :)"
comment,,1724095739.0,1,,,,,nc9090,lix7cse,"Thanks, I was about to buy a new one, and I came across this post! You saved me!"
comment,,1724143262.0,1,,,,,nc9090,lj0fj2x,Works! Thanks a lot!
comment,,1724364779.0,1,,,,,nc9090,ljg9z17,Beating it on the countertop fixed mine! Thank you.
comment,,1724364779.0,1,,,,,nc9090,ljg9zc4,Beating it on the countertop fixed mine! Thank you.
comment,,1725080455.0,1,,,,,nc9090,lksev7t,"I had to check out solutions on this as well, literally pressed on the left side and they turned right on!  Fantastic advice my friend."
comment,,1725784078.0,1,,,,,nc9090,lm315b7,"I know I’m three years late, but what exact tool do u need for the screws?"
comment,,1727005093.0,1,,,,,nc9090,locj5bs,"you are such a savior!  
i got mint back up and running, some cable somewhere was touching themotherboard\^\^  
thank you for sharing your findings and efforts!"
comment,,1727130406.0,1,,,,,nc9090,loll62m,"YOU SAVED ME.  
YES, still in 2024. <3 <3 <3 <3 <3 

THANK YOU!"
comment,,1727295902.0,1,,,,,nc9090,lowvl6j,Wow man wtf. Knocking solved it. Awesome 😭😭
comment,,1727801596.0,1,,,,,nc9090,lpu5n6z,"I am genuinely impressed, this truly works ! Applying some pressure on the left part of the motherboard (the one not covered by the yellow tape) seems indeed to be the solution. I ended up putting some cotton on that part to apply pressure."
comment,,1727980831.0,1,,,,,nc9090,lq6g8i4,It fixed it! Thank you so much!
comment,,1728113689.0,1,,,,,nc9090,lqfb3b8,thank you so much for this!!
comment,,1729671090.0,1,,,,,nc9090,ltb6f66,You sir are a true saint
comment,,1729761558.0,1,,,,,nc9090,lthh3kk,"Step number 3 worked. Dude, you are just an amazing human being, thank you very much for sharing this with us!"
comment,,1730616993.0,1,,,,,nc9090,lv56z2d,"thank you so much for this! fixed the issue for me, hopefully i wont need to keep doing this to get them to turn on. thankfully id already taken them apart once to replace the battery and this was a very easy fix. im not even sure how many years ive had these for, but i plan on keeping them as long as i can"
comment,,1730885910.0,1,,,,,nc9090,lvojfji,"My headphones stopped working immediately after i dropped them. They wouldn’t even turn on. I did as OP said: opened the back of the left side, where the motherboard is, and put a little pressure with my finger where the cables solder to the motherboard. They turned on without any problem. To make the fix permanent I put a little foam sticker, the ones you put under the legs of a chair, in that area and closed back the case. It works perfectly since. Thank you OP!!!"
comment,,1731600560.0,1,,,,,nc9090,lx3sgkd,"Man, literally it worked for me, tape alone didn’t fixed it and observed that when i place my finger on that exact region the headset turns on and when i remove it, it doesnt so what i did is place some foam and it is working, i’m gonna test it for a week, thanks a lot buddy"
comment,,1731833208.0,1,,,,,nc9090,lxkgdf1,"Absolute legend, was flinging mine around like a goose and dropped them. Popping a bit of bubble wrap inside to add pressure worked like a charm"
comment,,1731963447.0,1,,,,,nc9090,lxtg3oc,"It worked for me! Thanks a lot! To bad I ordered a momentum 4 in the meantime and knowing my weakness for headphones, i won't be able to return it ;)"
comment,,1732398085.0,1,,,,,nc9090,lyn4otm,"Hola, después de un año y pico lidiando con este problema. Acabo de abrir y probar cuanto de real tenia la información, ya sin mucho animo de poder encontrar una solución sencilla y GUALAAAAA. Funcionooooo que alegría tan grande. Muchas gracias amigo. Gracias por tu tiempo y por compartir la experiencia. 

Desde España quedo muy agradecido."
comment,,1735069933.0,1,,,,,nc9090,m3n16iw,"Worked for me, thanks!"
comment,,1737538475.0,1,,,,,nc9090,m8idzue,"Legend, just had to use this fix. The tape worked for a while but same issue started again. A ripped up cotton pad to apply pressure on the motherboard has returned my headset to its former glory! Thank you!"
comment,,1738687025.0,1,,,,,nc9090,may2ncu,Years later and this fix still works!!!
comment,,1739890978.0,1,,,,,nc9090,mdfset9,Holy shit I genuinely can't believe the 3rd tip worked 😂
comment,,1740021428.0,1,,,,,nc9090,mdqo710,"I have taken mine apart, moved wires about while holding down the button hoping that if there was a contact that it would tell me by flickering or something and applied pressure but I get no blue light. The two buttons pressed turn off the charging light, so I know that the buttons aren't broken, but I don't know where to go from here. Aren't all the wires insulated anyway? Please help"
comment,,1740686026.0,1,,,,,nc9090,mf4k5fi,So crazy that knocking on the left side actually just fixed it! Thanks for the post.
comment,,1740860410.0,1,,,,,nc9090,mfhl7fe,Thank you!! You are amazing. I had bought some XM5s for $55 second hand though but they felt too loose around my head so I took a chance and found your post and now they work.
comment,,1741595551.0,1,,,,,nc9090,mgzq2x9,"\>Knock few times hard at the left side of the headphone  
Wow, I was facing the same issue and this actually worked for me. lifesaver!"
comment,,1742713106.0,1,,,,,nc9090,mj9vycj,"Du absouluter gott

Die kopfhörer liegen seit 3 jahren rum bei mir weil ich es nicht hingekriegt hab jetzt an nem random sonntag mal wieder geschaut und leider jetzt erst deinen post gefunden. Es funktioniert einfach. Wie krass, vielen dank! !"
comment,,1743668276.0,1,,,,,nc9090,ml61o5w,THREE YEARS AGO AND THIS STILL WORKS! I THOUGHT MY HEADPHONES WAS BROKEEE
comment,,1743686738.0,1,,,,,nc9090,ml7384z,Merci milles fois!!!!
comment,,1744280927.0,1,,,,,nc9090,mmd5i24,"Three years on, and this post is still very much needed. Thanks so much."
comment,,1745854469.0,1,,,,,nc9090,mphxw1z,The 3 option acctully worked😅 thansk alot
comment,,1747357306.0,1,,,,,nc9090,msjrr84,"This thread is great. I was able to fix mine, which I gave up on almost two years ago! In my case, the small green wire made contact with the ribbon cable connector just where the little red arrow is pointing. isolating this area with some electrical tape kept it separate and now it works normally. Cheers, I hope this helps someone!

https://preview.redd.it/29pleqm5m11f1.png?width=150&format=png&auto=webp&s=be63b89bb999f0031cbbf5ddc6c87d59be93d88c"
comment,,1748774323.0,1,,,,,nc9090,mve6kad,"My on/off button did not have the ""click"" anymore. Bought new sparepart and replaced the small unit. Worked fine after that. 

https://preview.redd.it/oevut73wna4f1.png?width=478&format=png&auto=webp&s=2ef4820be94bdfa865eb802d1ac1ce5a18202eab"
comment,,1748881675.0,1,,,,,nc9090,mvm2kp7,"I know this is an old post but it's the top result on Google. Can I just say thank you to the OP. Opened up the left cup and sure enough the wires had shifted and were shorting on the motherboard. I have a habit of tossing them on a sofa when I get in from work so I guess over time that shifted the wires a bit.

Moving them a little and adding some tape underneath and now they're working again! Glad I didn't have to buy a new pair. I love my XM3s and the drivers are still as good as the day I bought them 6 years ago."
comment,,1748935139.0,1,,,,,nc9090,mvqbl6g,"Had the exact same problem this morning, knocked three times a bit rough on it a s a 'Hail Mary' and made me laugh so hard that this worked. Thx for sharing! Saved me a couple hundred euros."
comment,,1749598623.0,1,,,,,nc9090,mx3ym8h,This has been an absolute lifesaver for me. Just fixed my headset in 5 minutes. Thanks a lot! You're a true Internet hero.
comment,,1750244282.0,1,,,,,nc9090,myfdz2t,"Fixed my headphones cause of you, just had to push te wires around a little and now it works again! Thank you so much 🙏🙏🙏"
comment,,1751202627.0,1,,,,,nc9090,n0ehufx,"Great. Had already installed a new battery. But after moving the wires a bit from the motherboard all of a sudden it turned on again. Put back the original tape a bit better so wires keep in place. Did what you suggested: turning the headset on and off during the assembly stages, to see if it keeps working. And finally it does!
Thanks a million. "
comment,,1752898964.0,1,,,,,nc9090,n3xwqes,Thanks for the post.
comment,,1753942129.0,1,,,,,nc9090,n64a4a5,"Thanks for this! I was having this problem out of nowhere after charging and this came up in my Google search. I tapped the left side a few times and it turned on like normal! Years later, and you helped me not to panic!"
comment,,1754310160.0,1,,,,,nc9090,n6uxqk4,"u/theOmegalord Thank you Sir, you saved my wonderful colleague and myself a new purchase"
comment,,1754492239.0,1,,,,,nc9090,n78qc5t,"This is incredible.  
I was skeptical, but it worked!"
comment,,1754513989.0,1,,,,,nc9090,n7avof0,life saver!
comment,,1754514700.0,1,,,,,nc9090,n7ay38b,"Mine must have been caused by a different issue. The wires on the motherboard look completely normal, neatly seperated from each other. Part of the motherboard is exposed but there is no loose wire inside that will make it short circuit. After manipulating the wires, it still won't turn on. None of the lights will go on except the charging light. I'm starting to think if the battery is toast."
comment,,1755143507.0,1,,,,,nc9090,n8lclcb,"4 years later, this is still helping. Just fixed my headphones with this helpful thread."
comment,,1757007070.0,1,,,,,nc9090,ncer4bx,"After so many years these headphones stopped working, i was sad and devastated. This HELPED ALOT. Now they turn on as they r supposed to."
comment,,1757936042.0,1,,,,,nc9090,nebug20,"Thanks loads, man."
comment,,1758538831.0,1,,,,,nc9090,nfku05z,Thank you! Just found this after taking the battery out and this solved the problem at once 😎
comment,,1759434086.0,1,,,,,nc9090,nhf4z87,"i threw it down and it turned on thanx for the tip 

![gif](giphy|tIeCLkB8geYtW)"
comment,,1762081523.0,1,,,,,nc9090,nmoouy4,"Thanks, I of course just assumed the battery is dead and ordered a new one. While waiting for the battery to arrive, I opened them up and measured the original: 4.17V... the battery is fine. Then I googled, found this and opened the left ear cup. I plugged the battery back in with left cup open and they started right up confirming this was my issue. A piece of kapton and fabric tape later, I buttoned it up and its still working fine. Thanks!"
comment,,1762451141.0,1,,,,,nc9090,nngcru8,"huy buenisimo me salvaste, gracias, funciono"
comment,,1764417139.0,1,,,,,nc9090,nrd896y,"amazing, thx this helps to fix my headset - let me know how if can sent u a tipp -  legend"
comment,,1766334535.0,1,,,,,nc9090,nv7w00j,"Incroyable, Merci ! Je viens de ressortir ce putain de casque qui dormait dans un placard depuis 2 ou 3 ans, faute de pouvoir le rallumer. J'avais déjà changé la batterie, opération facile et peu coûteuse, mais échec... Et puis je suis tombé sur votre solution, alors comme il n'y avait plus rien à perdre... Et ben miracle !!! en bougeant 2 ou 3 fils et en calant bien tout ça, tout refonctionne nickel. À 300 € le casque, j'avoue que la pilule ne passait pas, même avec le temps. Vous venez de libérer une partie de mon cerveau avec, en plus, la satisfaction de l'avoir fait moi-même (pour le prix le mieux aurait été que tout fonctionne toujours, bien entendu). 
Merci merci merci !"
comment,,1766574879.0,1,,,,,nc9090,nvp91yz,Thank you for all the comments here. Fixed it with preassure on the MB
comment,,1768139690.0,1,,,,,nc9090,nyyz8cz,"This is an old post but just wanted to share that this was one of the easier fixes that I think anybody can do.  
I used an old credit card to pry the ear cover open as it was the first thing I had laying around and it worked great.

  
Such a simple fix that saves quite some money. Thank you for your post!"
comment,,1771504987.0,1,,,,,nc9090,o68dl7q,The foam trick was next level. Thanks man. The night before My headphones fell from 2 Meyers high and wouldnt Power up but this fixed It.
comment,,1772612373.0,1,,,,,nc9090,o8k855q,"Mine wasn't working and I would simply press down the right hand corner and it would fix it.


After a while this stopped working.


With a DMM,I tested the voltage of the battery it was fine.


I measured the voltage of the PCB, was fine.


I measured the voltage of the switch was fine.


I realised it was the Sony IC (BGA).


I was gonna reflow it but decided to put a big ball of kapton tape over it and close the headphone come to maintain pressure working now."
comment,,1772650390.0,1,,,,,nc9090,o8n4dor,AWESOME!
comment,,1774775486.0,1,,,,,nc9090,od3pokd,"Thank you, this fixed my headphones! So lucky I found your post and that this actually resolved the problem. What a fail of design by Sony…"
comment,,1775987818.0,1,,,,,nc9090,ofq4eed,thank you so much
comment,,1776978020.0,1,,,,,nc9090,ohw69fk,Still saving headsets all these years later. My wife's set had the issue where you needed to reseat the motherboard.
comment,,1627782273.0,1,,,,,nc9090,h79ml5t,nice bro
comment,,1628720422.0,1,,,,,nc9090,h8l8tcq,"Gosh darn it, it worked! Legend!!"
comment,,1630895373.0,1,,,,,nc9090,hbrg3tg,"Do you know anyone with WH XM4 who has experienced this? I'm a WH XM4 owner, and after reading this post, I'm kind of afraid this might happen to my headphones as well. Thank you"
comment,,1633216790.0,1,,,,,nc9090,hf5op9v,"If this doesn’t help any you can also try this. Ended up working for me. Thanks OP
[power button](https://youtu.be/zrT6qLt3KQU)"
comment,,1636810794.0,1,,,,,nc9090,hkgeta6,"I can't even get past unbolting them, am I that weak?"
comment,,1637847035.0,1,,,,,nc9090,hm15vve,I had dropped my XM3 and it didn't turn on for a couple of days. Found this post and it *works*. Thanks a ton mate !!
comment,,1637867177.0,1,,,,,nc9090,hm2eaam,"Thank you omegalord, you are the only one who actually figure how to solve this problem out. I followed your steps but somehow I wasn't able to fix em. Could you maybe film a YouTube video and show the process step by step? That would be amazing! Thank you again for your help!"
comment,,1638913070.0,1,,,,,nc9090,hnn4q9c,"Omegalord your post says to open the left side, but the YouTube video says to open the right side.  I have the right side disassembled and I disconnected the battery to see if that fixes it.  Is it actually the left side that I need to disassemble instead?"
comment,,1641940838.0,1,,,,,nc9090,hs9rlum,"Holy shit, i am back and bassy this fix freking worked omg omg omg ty bro beans <3 

Already told my insurance that they broke, cuz they did lol, and got a fresh pair of sony wf-1000xm4, so now i have both hahaha. U made my day 

&#x200B;

One detail. It did not work to simply move and seperate the wires, but i had to press the motherboard pretty hard in the middle on the black spot, and for some reason that worked? I think you even mention it further down, I just did not understand what you meant. But for others with the same issue, try first and separate the wires so that they are not touching eacher. Here i am talking about wires going to different places, not the ones coming from the same place, and then make sure they are not touching the motherboard as well. After this press the motherboard in the middle on the black spot. That worked for me after i pressed on it relatively hard. Maybe you have to press another place in different circumstances? 

&#x200B;

Does someone know why it helps to press? Does is connect something that was maybe shaken loose underneath? 

&#x200B;

Again thak you so much, saved my day, now jamming away happily again"
comment,,1642509888.0,1,,,,,nc9090,ht64vuk,[removed]
comment,,1644523001.0,1,,,,,nc9090,hwesyzl,"This thread has been AWESOME! I just performed my third tear-down/wire fiddle/jiggle exercise that u/theOmegalord described, and like others -- I seemed to work only for a short while. My mission this time: 100% success. I managed to get it to work....twice....and even got that really cool Star Trek high-pitched whine because the headphones were confused....but the headphones once again reverted back to their crummy grounded out state. I even brought out a multi-meter just to sanity check power charge and battery charge. All good.

By accident, I realized what was happening. LEFT SIDE. If I pressed DOWN on the small motherboard WHILE PRESSING the power button, they powered up. I noticed two things: 1) slight ""give"" on the motherboard itself where there was some movement toward one of the edges opposite the two screws holding it down. 2) the blue wire next to one of the screws almost seemed to be under the screw. Was hard to tell.

My solution so far: unscrewed and resat the motherboard, and made sure the blue wire was away from the screw. So far -- so good."
comment,,1645070581.0,1,,,,,nc9090,hx9m7tw,"bro how is this the actual fix though, thanks a lot man"
comment,,1646517086.0,1,,,,,nc9090,hzi1mxc,thanks for sharing Lord! You  just saved me about $350 for just replacing the battery with a spare one I had from the old broken one :-)\~
comment,,1647035829.0,1,,,,,nc9090,i0ang3p,"One more pair of headphones saved. Thank you sir! the knocking made them work but after i put the cover on they stoped working. I've cut a piece of mask :)), folded it a couple of times to create some pressure on the board and Bob's your uncle. I don't think it's a short though, my theory is that the some pins/bals of the Sony chip (biggest one on that board) came loose on impact. The correct fix would be reballing the chip on board but the cloth also made it work for me. Thanks once again! 200$ saved ( i was already looking to buy a replacement)"
comment,,1647265762.0,1,,,,,nc9090,i0m78mf,"Wow... honestly with all the tutorials out there and solutions/fixes out there (which I'm sure has helped countless, and have saved many headphones), B\*tch slapping the left headphone gently solved it. 

like... wow!. thanks, and kudos for providing all the details :)"
comment,,1647950077.0,1,,,,,nc9090,i1nf5sp,"You saved my life, thx!!!"
comment,,1648190684.0,1,,,,,nc9090,i21axu6,Thanks!
comment,,1648593622.0,1,,,,,nc9090,i2mmuq2,"Thank you for this post. Headphones fell on the ground, worked fine for a while but then I couldn't turn them on anymore. After trying resetting and such, which didn't help, I disassembled the left earpad and realized after the 3rd time that the circuit board came a bit out of its housing. After pressing it down it worked again. I put some material on it and clamped it down with the housing, didn't have issues anymore after."
comment,,1649081199.0,1,,,,,nc9090,i3cqrpx,I did as your guide and it worked! Thank you so much.. You are a life saver.. I added electrical tape and some tissue paper instead.. Huhu
comment,,1649445294.0,1,,,,,nc9090,i3xtu2z,Holy shit knocking actually worked ! Thank you so much !
comment,,1652653869.0,1,,,,,nc9090,i8r04bq,YOU LEGEND I HAD BEEN HITTING IT FOR WEEKS
comment,,1653466308.0,1,,,,,nc9090,i9wtnx9,"Thank you, Omegalord, your solution also fixed the not powering on issue. But now I have this high pitch whine which seems to hit different frequencies when I am moving the cables. Did anybody find a fix for that?
I am thinking of resoldering the cables, but would prefer a different type of solution first."
comment,,1655353075.0,1,,,,,nc9090,icjmcf2,"I did pretty much what you described but it still isn’t turning on, it charges but no luck at all. I may try again but I’m a bit lost on if I see anything irregular"
