Type,Title,Time Stamp,Score,Id,Url,Num Comments,Post Text,Post Id,Comment Id,Comment Text
comment,,1756989031.0,1,,,,,1n7wwyz,ncd24b2,"Well i dont know who at dyson your related to, but congrats."
comment,,1757095291.0,0,,,,,1n7wwyz,nclhg2z,"You are pretty confident for someone who is 100% wrong.

And im not advocating for people to do this, but if dyson won't honor warranties, do what you have to do."
comment,,1757272761.0,1,,,,,1n7wwyz,ncyfwb1,Feel free to link examples
comment,,1757001286.0,7,,,,,1n7wwyz,nce6ll5,So is giving a warranty that is not honored. If you want feel free to press charges.
comment,,1757007862.0,3,,,,,1n7wwyz,ncetyzy,"And also might win the lottery or get in a car crash, or dyson might honor your warranty. All improbable by there is a chance."
comment,,1756989632.0,1,,,,,1n7wwyz,ncd3t75,And people STILL doubt us!!!
comment,,1756956099.0,15,,,,,1n7wwyz,ncb95ii,"My type of girl, go get justice 🦅🦅"
comment,,1757170732.0,2,,,,,1n7wwyz,ncqp6lv,We have no doubt you’ll win. It is the getting paid part we are worried about.
comment,,1756990624.0,1,,,,,1n7wwyz,ncd6o36,the business can just pay to have the complaint resolved or entirely removed
comment,,1756994379.0,3,,,,,1n7wwyz,ncdiavr,Sure. I wish you luck on your claim. All I’m saying is to avoid your situation altogether this is what I do.
comment,,1757101036.0,3,,,,,1n7wwyz,ncm0joa,"That doesn’t matter, you bought a fake machine. They don’t need to fix or replace it. If the agent assumed it was real when you sent it, then they realized it was fake, you don’t have a case."
comment,,1757061467.0,2,,,,,1n7wwyz,ncium9d,"Just out of curiosity,  did you buy from a reputable retailer,  or second hand used from Ebay?"
comment,,1756990744.0,3,,,,,1n7wwyz,ncd71bu,"As much as I would love the downfall of our corporate overlords, I assure winning easy and court do not belong in the same sentence"
comment,,1756995799.0,1,,,,,1n7wwyz,ncdn4sr,I was considering taking them to small claims court if the issue wasn't resolved after my wife went into the Dyson store.
comment,,1764516080.0,2,,,,,1n7wwyz,nrjs8jp,I agree completely absolutely shit and they are proud of themselves that night when they lay down I don't see how somebody can go to sleep at night knowing they're hurting people like that stealing from people
comment,,1756989363.0,-2,,,,,1n7wwyz,ncd31r8,Mmmhmm
comment,,1756964464.0,4,,,,,1n7wwyz,ncbqvfr,Yeah I was just curious because someone off here tried to tell me Amazon wasn’t reputable lol 🤣wasn’t trying to argue I was genuinely curious. 🤷🏽‍♀️
comment,,1756987133.0,2,,,,,1n7wwyz,nccwzli,"Per the terms of the warranty it needs to be purchased from an authorized retailer. Chances are it was stolen or is a fake when you purchase on eBay. Sorry but they are correct you don’t have a warranty regardless of any messages it’s in the terms and agreements. 

There is a secondary team that does exchanges. Serial numbers are checked and if you aren’t the original purchaser, the warranty is voided and they have the right to retain the machine. BBB is a joke. They won’t and can’t do anything."
comment,,1756991804.0,2,,,,,1n7wwyz,ncda82r,You actually can!!! Call them and tell what happened they will initiate a charge back for you
comment,,1757043077.0,1,,,,,1n7wwyz,nchur91,"Yeah, that’s illegal af. I hope you get 10x your refund plus lawyers fees."
comment,,1757137851.0,2,,,,,1n7wwyz,ncotdu7,"The service center will do that too. They just can't promise anything on the phone. I had an issue once and the guy gave me a new one and said leave this here, I'll figure it out. I assume they sell it refurb later."
comment,,1757361160.0,2,,,,,1n7wwyz,nd53jrt,You can literally just return it to Costco and get a new one. I’ve done this once already with the V12 when it would suddenly and sporadically turn off during use. Picked up the more expensive V15 because I’ll do it again if I have to.
comment,,1757013461.0,7,,,,,1n7wwyz,ncfd6e7,"Costco doesn’t usually. Their contracts make returns the vendors issue. 

I returned a 2 year old Dyson stick vacuum because it just stopped working. The lady was like “lots of these get returned” and then I bought a vacuum for half the price and it works better….

Dyson is shit. My wife loves her hair thing though"
comment,,1756973863.0,4,,,,,1n7wwyz,ncc75gn,[deleted]
comment,,1756960114.0,8,,,,,1n7wwyz,ncbi8nx,They'll be ok
comment,,1757361295.0,1,,,,,1n7wwyz,nd540ao,"If it’s that big a problem for them, they can stop selling a shitty product. I think it’s why Costco doesn’t sell Xbox controllers anymore, since their return policy technically covers them and doesn’t have an exclusion for them, yet they shit the bed a little after a year from purchase."
comment,,1757083605.0,2,,,,,1n7wwyz,nckcvb0,Somebody returned 5 year old couch saying they are not happy either it🤣
comment,,1756989095.0,3,,,,,1n7wwyz,ncd2aph,"Haha, I am in the UK, maybe the quality of their support is different here compared to the USA."
comment,,1757097145.0,2,,,,,1n7wwyz,nclnmou,"And you're pretty confident for someone who's saying you're not advocating this. You're clearly suggesting they commit fraud and get caught doing it. What you don't think they'd check serial numbers?

As for Dyson not honouring warranties, it's clearly stated in the T&C that items must be purchased from a reputable retailer, Joe Blogs from Ebay does not count . When registering the warranty, you're accepting the T&C.

The agent made a mistake by saying they'd send a new one (we're all human), they likely thought it was bought from a retailer. Dyson should've returned the faulty one as soon as they realised this. Had OP not been fussy about colour, then we wouldn't be commenting."
comment,,1757274235.0,1,,,,,1n7wwyz,ncyl6lk,Feel free to Google return fraud charges
comment,,1757149939.0,0,,,,,1n7wwyz,ncpe28l,"No it isn’t. That’s a civil offence. Return fraud is a criminal offence, it’s theft just like stealing one from a Dyson shop because you had a warranty dispute with them would be."
comment,,1756962067.0,5,,,,,1n7wwyz,ncbm9oy,"Yeah seriously, I love the attitude!!"
comment,,1757172808.0,1,,,,,1n7wwyz,ncqvooc,All I can do is try
comment,,1756995623.0,2,,,,,1n7wwyz,ncdmit6,That’s fine they can go ahead and pay to do that. It will take me 15-20 minutes to send this in. If we don’t do nothing Dyson will keep getting away with this BS. Look at all the comments this post is receiving with similar situations.
comment,,1757106455.0,1,,,,,1n7wwyz,ncmiltd,Who in the world said I bought a fake machine?!?! This is something you’re making up!
comment,,1757106599.0,0,,,,,1n7wwyz,ncmj2du,You think it’s legal for a company to just keep your stuff? What planet do you live on where a judge would NOT rule in favor of my case.
comment,,1757074463.0,1,,,,,1n7wwyz,ncjksuo,It was brand new from eBay.
comment,,1756995562.0,0,,,,,1n7wwyz,ncdmbc0,This particular situation is very clear cut. There’s nothing to misinterpret here. I have everything in writing and for me is just filing the paperwork with small claims court. In my state I can file for damages as well which I will.
comment,,1764519164.0,1,,,,,1n7wwyz,nrk1gyw,Where are you located? Can you take them to court?
comment,,1756989742.0,1,,,,,1n7wwyz,ncd449s,You think it’s ok someone can just take your belongings and not give it back lol? That’s super weird.
comment,,1756989536.0,1,,,,,1n7wwyz,ncd3jgk,Yeah these Dyson fanboys and girls don’t care if their beloved Dyson scams people
comment,,1757003494.0,1,,,,,1n7wwyz,nceegv5,[deleted]
comment,,1756988623.0,1,,,,,1n7wwyz,ncd0yrb,Like I said all of this terms and service is null and void when they said they will replace my Dyson 7 months ago. The fact they are just now telling me this 7 months ago has no legal impact on my case and I will win this one.
comment,,1756988767.0,1,,,,,1n7wwyz,ncd1df6,Also they DO NOT have the right to retain my machine for 7 months after they told me they will replace it. If they had told me 7 months ago my machine was purchased from an unauthorized place ok totally fine but that’s not what happened to me. My serial number was registered on the Dyson app.
comment,,1756995425.0,1,,,,,1n7wwyz,ncdlu6g,Ohhh wow I might do this!
comment,,1757103727.0,2,,,,,1n7wwyz,ncm9lef,That not how small claims court works.
comment,,1757290453.0,2,,,,,1n7wwyz,nd01mq6,"Agreed, here in AU Dyson is the shittest brand on the market but their distributors will take anything back and credit a retailer.........so retailers just make shit up, even when the customer has caused damage

Being the shittest brand doesn't mean you don't sell well, it just means smart people don't buy your product

I once had a laptop brought back in and the guy had hammered a  SIM card into a USB port.......we got him a new one and we got our $5400 credit within a week :)"
comment,,1756999384.0,1,,,,,1n7wwyz,ncdzshf,"No they don’t, they’ll usually charge back the manufacturer."
comment,,1757185803.0,1,,,,,1n7wwyz,ncs2pb0,[deleted]
comment,,1756989190.0,1,,,,,1n7wwyz,ncd2ke1,Its because your country has laws related to support and warranties. Its the wild west in the USA.
comment,,1757099391.0,0,,,,,1n7wwyz,nclv2ou,"Well sounds like you got this figured out. Good luck on your high horse, how's the weather up there?"
comment,,1757274415.0,1,,,,,1n7wwyz,ncyluah,"Do you know that almost anything can be considered a crime? Now go ahead and link those articles to people be hauled away for it. You seem to think this is a common occurrence.

And for the record I made this comment for people who have warranty on their vacuum, and dyson is not honoring it. That is the reason for the post. This isn't some life hack bs, its just trying to use the fraudulent dyson warranty we all paid for."
comment,,1757157336.0,2,,,,,1n7wwyz,ncpqsv9,Call the cops
comment,,1756989903.0,1,,,,,1n7wwyz,ncd4kha,"This reminds of the time someone listed a ticket with an incorrect section on Ticketmaster’s official “verified fan resale” website and when I said I wanted a refund because it was the wrong section Ticketmaster said “sorry can’t do that bc it’s resale” and I was like well, actually I paid YOU, it was on YOUR WEBSITE (not a third party), you “verified the sale”, and I will be getting my money back. So I filed a chargeback and my bank sided with me 😇 I’m not blacklisted from them either but I avoid them at all costs now. Justice 🦅"
comment,,1757160923.0,2,,,,,1n7wwyz,ncpyg4g,[removed]
comment,,1757106951.0,2,,,,,1n7wwyz,ncmk70e,You did once you said you got it from EBay.
comment,,1757107251.0,2,,,,,1n7wwyz,ncml5nz,That’s literally standard practice of anti-counterfeit enforcement. Do you think Rolex would send back a fake watch just because you thought it was real?
comment,,1757074977.0,2,,,,,1n7wwyz,ncjm5wd,From a reputable company or joe blogs selling on eBay?
comment,,1757164286.0,2,,,,,1n7wwyz,ncq6pbz,"This is hilarious. I knew from the beginning once OP didn’t include where they bought it. eBay! I bet you didn’t include that tidbit when you first spoke to Dyson either. Your written proof doesn’t count for shit if you weren’t forthcoming. Judges don’t like sneaks. 
Enjoy yourself in small claims. You’re going to cost yourself so much money."
comment,,1757107366.0,1,,,,,1n7wwyz,ncmlitj,"It’s not, you are trying to swap out a fake product and you got caught. As much as I love shitting on Dyson, enjoy losing."
comment,,1764519336.0,2,,,,,1n7wwyz,nrk20if,I'm in Colony New York Albany County they're in Texas big distance but I should be able to still do it that's what I want to do I know that they can do over the phone Court sessions as long as I provide my documentation just as you did everything is in email thank God and I have proof of purchase on Amazon invoices everything I need tracking number
comment,,1756991247.0,1,,,,,1n7wwyz,ncd8j9q,I don’t disagree with the premise at all.  Warranty’s often only apply to the original owner / properly channeled purchaser.  It’s not fair and I don’t agree with it but alas it’s legal.
comment,,1757011244.0,1,,,,,1n7wwyz,ncf5o4j,Oh I know lol 😂 I got so many downvotes for stating that. So much misinformation lmao.
comment,,1757150483.0,1,,,,,1n7wwyz,ncpext0,That not how it works.
comment,,1757006056.0,2,,,,,1n7wwyz,nceng6e,"They don't have the right to retain your machine at all, actually, unless they can legally prove it was stolen.


Make sure you mention this in your court case."
comment,,1757114434.0,0,,,,,1n7wwyz,ncn6h66,"I’m well aware of how small claims works 🙄 Thanks for trying to give me a completely unrequested lesson, Teach."
comment,,1757294105.0,1,,,,,1n7wwyz,nd0bvul,"I hope some of the others see this comment. This is what I meant, because when you return a product it usually goes on a pallet in the back, and the store applies for the credit. Then the pallets of goods eventually get auctioned off. I ran a company and we had percentages figured for warranty and for returns.

No one is gonna get the shitty broken vacuum that dyson refuses to warranty. If they did it correctly no one would have to do this grey area warranty stuff."
comment,,1757185950.0,1,,,,,1n7wwyz,ncs369t,Hahah they want the reassurance🤣
comment,,1757015264.0,2,,,,,1n7wwyz,ncfj6k0,"Not just in the USA, I bought mine in Hungary from their Hungarian website, and their customer support is tragedy! I had been told that they going to replace my vacuum, but more than 3 months nothing happened. They got my vacuum and my money, I only have the dust…"
comment,,1757100657.0,2,,,,,1n7wwyz,nclzaa6,"No high horse here, just my opinion, or is your opinion more relevant.  Others have given their opinion, some people agree some don't. 

Imagine you bought a Dyson product or any product, you got home, opened it, and discovered it was a faulty  returned by fraud item. How would you feel ? So before you offer silly solutions, think about it.
And, why should Dyson honour an item that was bought from Ebay it's basically second-hand even though it's brand new it's still second-hand!"
comment,,1757275284.0,1,,,,,1n7wwyz,ncyoyut,Here you go silly [return fraud latest arrests](https://www.google.com/search?q=return+fraud+arrest&client=ms-android-samsung-gs-rev1&sca_esv=e2f8f01341ab6ed1&biw=360&bih=670&tbm=nws&ei=YOS9aPzlFu_QkPIP_IKCkAk&oq=return+fraud+arrest&gs_lp=Eg9tb2JpbGUtZ3dzLXNlcnAiE3JldHVybiBmcmF1ZCBhcnJlc3QyBhAAGBYYHjIFECEYoAEyBRAhGKABMgYQABgWGB4yBhAAGBYYHjILEAAYgAQYhgMYigUyCxAAGIAEGIYDGIoFMgsQABiABBiGAxiKBUiuClCDCFiDCHAAeACQAQCYAZsBoAGYAqoBAzAuMrgBA8gBAPgBAYoCGW1vYmlsZS1nd3Mtd2l6LXNlcnAtbW9kZXOYAgKgArcCwgIIEAAYgAQYogTCAggQABiiBBiJBcICBRAAGO8FmAMAiAYBkgcDMC4yoAfoCLIHAzAuMrgHtwLCBwMzLTLIBx0&sclient=mobile-gws-serp)
comment,,1757167719.0,1,,,,,1n7wwyz,ncqg6b9,Will do that as well!
comment,,1757107402.0,1,,,,,1n7wwyz,ncmlmzv,So you’re saying it’s impossible to get a real Dyson off eBay?
comment,,1757183978.0,1,,,,,1n7wwyz,ncrwqlq,"Buying a Dyson off eBay doesn't equal buying a ""fake machine"".

Let's use some common sense, please."
comment,,1757107501.0,1,,,,,1n7wwyz,ncmlyet,This is not what happened to me. You’re creating an imaginary scenario. My device was authentic and it was registered with Dyson. They confirmed they received it and were willing to send me a replacement.
comment,,1757075107.0,1,,,,,1n7wwyz,ncjmikf,I know what you’re getting at but where I bought it from at this point does not matter. I have written proof they will replace the Dyson and I have a warranty. They can’t change their story 7 months later this will not hold up in court for them.
comment,,1757167501.0,1,,,,,1n7wwyz,ncqfjjb,I registered the Dyson with Dyson. They said they will replace it. Nobody asked me 7 month ago where I bought it they already made a commitment based on my Dyson being registered with them. The fact they are asking me 7 month later where I bought it is irrelevant now. Them not giving me my Dyson back is illegal.
comment,,1757167573.0,1,,,,,1n7wwyz,ncqfr07,Nothing hilarious about this. Read the comments Dyson does this with people who bought straight from Dyson.com. You’re just a Dyson bot.
comment,,1757107610.0,0,,,,,1n7wwyz,ncmmast,Nah I’ll win this. I didn’t buy a fake item they confirmed it was authentic. The reason they aren’t sending me mine back is because it’s been 7 months and they probably no longer have it. Too bad for them.
comment,,1764537501.0,1,,,,,1n7wwyz,nrlozrx,That’s an easy case in my opinion. You might be able to file in small claims court there in NY and go from there.
comment,,1756995503.0,1,,,,,1n7wwyz,ncdm3vr,I’m not talking about warranties right now this is totally irrelevant in my case. First they have my belongings and won’t return it. Second they already promised me in writing they will exchange it and that I indeed DO have a warranty. This is an easy win in court.
comment,,1757167675.0,1,,,,,1n7wwyz,ncqg1qz,So you think it’s ok for them to keep my property?
comment,,1757008180.0,1,,,,,1n7wwyz,ncev46c,Of course I will!
comment,,1757150544.0,2,,,,,1n7wwyz,ncpf18q,Apparently not because you think op has a case.
comment,,1757298190.0,1,,,,,1n7wwyz,nd0n6eq,"In Australia the process works this way to ensure great customer service and zero electronic waste

1. Accept the return from the customer, if reasonable (under 90 days + no major visible damage) replace on the spot

2. Apply for a defective item credit

3. Ship the product back to the manufacturer including all details including invoice, purchase invoice and a job sheet detailing the fault

4. Send the product back ONLY when you have enough of the same product and then you will receive a mass credit once the manufacturer processes it. For brands like HP, Lenovo, Samsung, LG, Dyson they don't care about money when it comes to retailers........moreso market penetration, I saw a credit from Dyson once for AUD$250,000 for a bulk credit on faulty items......paid to us :)"
comment,,1757102597.0,0,,,,,1n7wwyz,ncm5ry1,Obviously you no nothing about retail. Imagine you knew how things work.
comment,,1757275412.0,1,,,,,1n7wwyz,ncypf5h,"Well that solves it, all the cases you linked to with over 6 figures in return fraud with months to years timeframes was exactly what we were talking about. Case closed. 

You have the reading comprehension of a 1st grader."
comment,,1757107440.0,1,,,,,1n7wwyz,ncmlred,eBay isn’t an authorized dealer. It’s different if you bought it off the actual dyson eBay store.
comment,,1757107550.0,2,,,,,1n7wwyz,ncmm3wm,Registration does not mean it’s real… idk how to explain that fake numbers work to register on my dyson.
comment,,1757076123.0,3,,,,,1n7wwyz,ncjpcyt,"They obviously weren't aware of where you'd purchased at the time and thought it was bought retail. Warranty states or it used to , says must be purchased from reputable, the worse thing that can or has happened is that the agent who said you'd get a new one gets a telling off. Even if you win SCC the chances of them coughing up is slim, but good luck, at the least they should be sending the faulty one back, the way I see it you should've accepted the one they originally offered before they actually realised what was happening different colour or not"
comment,,1757107641.0,2,,,,,1n7wwyz,ncmmea8,Show us your receipt
comment,,1757003573.0,3,,,,,1n7wwyz,nceequy,I would say at this point your best shot is at getting a replacement with honey / squeaky wheel.  Your time / hassle in the form of legal shenanigans probably won’t go anywhere.  You probably have a high probability of getting a replacement with well worked emails / complaints .  Communicate in a way that makes you someone the reader will want to sympathize with.  I am  really good with that technique for sure !  Perhaps you can be too.
comment,,1757003098.0,2,,,,,1n7wwyz,nced2j8,[deleted]
comment,,1757175596.0,0,,,,,1n7wwyz,ncr4gl4,"If they actually take it to court, they do. They were effectively robbed of $600 by this company. They need to skip small claims and get a lawyer and dig their teeth in. This isn’t only happening to OP. This is around the 10th post I have seen where Dyson is doing this to people. Someone needs to start a class action and really hit them where it hurts. I don’t care how big a company is. You don’t get to steal from people. If you look around online you can see that they aren’t only doing it with airwraps either. They are doing the same scam on people who are sending in their much more expensive fans and vacuums."
comment,,1757103483.0,2,,,,,1n7wwyz,ncm8qy5,"You seem to know a lot about what I don't know! 
Imagine if I had a very successful retail business that I don't know how it works or how I've managed to thrive since 2019 , Just imagine that! 
Imagine someone having a different opinion from you and having to come down off their high horse, just imagine that also!"
comment,,1757278403.0,1,,,,,1n7wwyz,ncz02ku,Lol ok bro
comment,,1757107670.0,0,,,,,1n7wwyz,ncmmhlh,They confirmed it was real when they receive it at their warehouse. Again you’re creating BS nonsense. I will keep fighting this you DYSON BOT
comment,,1757077440.0,1,,,,,1n7wwyz,ncjt6q4,I’d accept mine back but they don’t want to send it. Yes now in hindsight I would taken that color.
comment,,1757107937.0,0,,,,,1n7wwyz,ncmnc97,I don’t think you understand how the law works. Once they promised me in writing they will send me a replacement they made a guarantee to me that it will get replaced no matter what. This is what a judge cares about they don’t care about details like their warranty policy. They care about what was said and what happened since. Anyway I’m not going to argue with someone who is creating scenarios when Dyson themselves told me the Dyson was real.
comment,,1757004977.0,1,,,,,1n7wwyz,ncejlk0,What in the world are you even talking about?! I probably never sent them the product?! If anyone here wants to see proof I will more than happy to send It via DM you included. It DOES NOT matter what dysons or ups policy says I’m talking about my legal rights which supersede any of this. I have in writing them confirming their received a physical product MY airwrap. I have proof of them saying they will send me a new one. I also have proof of them saying they will not send mine back. This is an easy legal win for me.
comment,,1757249629.0,1,,,,,1n7wwyz,ncwaybq,What refund? OP bought it off eBay and I’m pretty sure it wasn’t the Dyson storefront. A pretty vital part they left out of their initial post lol.
comment,,1757436254.0,1,,,,,1n7wwyz,ndaizvd,"I promise they don’t. 

Especially bc she denied the replacement they offered."
comment,,1757103529.0,1,,,,,1n7wwyz,ncm8wrj,"Honestly, you make it pretty clear you dont know much."
comment,,1757096948.0,1,,,,,1n7wwyz,nclmz0h,[deleted]
comment,,1757432598.0,1,,,,,1n7wwyz,nda6aqj,"So…you downvoted me because OP left something out of their original post and I was supposed to magically see that this new info materialized out of thin air since I posted this? Ok, cool lmao."
comment,,1757179794.0,1,,,,,1n7wwyz,ncridpr,"What do you know? Telling someone to return a faulty item in a fraudulent way tells me how clever (not) you are. Next, you'll be telling me you have a job, lead a normal life, and pay your way!"
comment,,1757099858.0,1,,,,,1n7wwyz,nclwmko,All I need to do is file a lawsuit in small claims court. It will cost me $200 here in Florida. I will arrive to court with all the conversations we’ve had and they can spend $500/hr to send their lawyer or they can settle with me for much less. I understand they are a large corporation but the law is on my side and that trumps their size.
comment,,1757435637.0,1,,,,,1n7wwyz,ndaguhw,I didn’t downvote anyone lol but i thought I’d give you the information to possibly reform your opinion possibly. I don’t care either way it doesn’t effect me 🤣
post,"I know this is pretty dumb, but I do actually use it",1706535047.0,396,1advcql,https://v.redd.it/vdhl3lhosdfc1,61.0,,,,
comment,,1706537318.0,17,,,,,1advcql,kk3t9zb,Embarrassing.....where can I buy it lol
comment,,1706539838.0,7,,,,,1advcql,kk3zg3m,Perfect for cellphone addicts everywhere...
comment,,1707786210.0,3,,,,,1advcql,kq614nj,"Why do we need to be constantly glued to a screen. I realize I’m looking at one typing this but aren’t you supposed to, you know, be looking at where you’re vacuuming?"
comment,,1706622069.0,2,,,,,1advcql,kk98er9,Whatever helps get the floors clean lol.
comment,,1716029988.0,2,,,,,1advcql,l4l1qgg,Fuck your attention span
comment,,1706542017.0,1,,,,,1advcql,kk456ij,LOL
comment,,1706621916.0,1,,,,,1advcql,kk9827j,Nice clip action!
comment,,1706622316.0,1,,,,,1advcql,kk98z88,We did amuse ourselves to death after all
comment,,1706622968.0,1,,,,,1advcql,kk9ahfx,Do you have one for a tooth brush? XD
comment,,1706625020.0,1,,,,,1advcql,kk9fez2,OH MY GAWD!!!
comment,,1706625848.0,1,,,,,1advcql,kk9hibh,I would not call it dumb
comment,,1706626700.0,1,,,,,1advcql,kk9jpvj,I love this!  To make you feel better: I made something similar for my steam deck because I wanted to be able to play games and watch movies at the same time on the go.
comment,,1706627592.0,1,,,,,1advcql,kk9m2jl,"Thought they were recording the action, like a dash cam"
comment,,1706628711.0,1,,,,,1advcql,kk9p5bk,"That's a first world problem solution if I ever saw one:)
Audiobooks are mine"
comment,,1706629114.0,1,,,,,1advcql,kk9q9m5,"Tried linking a game you play by tilting your device, i think that would make vacuuming more interesting. Game called metaballa"
comment,,1706629324.0,1,,,,,1advcql,kk9quqp,"Can you put a scope and a laser on it to? I want a tactical dirt devil, maybe some swifter launcher under-barrel attachment"
comment,,1706631851.0,1,,,,,1advcql,kk9y14p,Battery doesn't last long enough to watch anything substantial!
