Type,Title,Time Stamp,Score,Id,Url,Num Comments,Post Text,Post Id,Comment Id,Comment Text
comment,,1778238924.0,1,,,,,1t6669v,okm8qsa,"If they didn’t kill LittleBigPlanet, they could have made their own level showcasing their history"
comment,,1778239044.0,1,,,,,1t6669v,okm91mu,Great! Bring MiniDiscs back!!
comment,,1778272336.0,1,,,,,1t6669v,okph8y6,"Xperia, Walkman, Alpha, those are just some of the product i really admired from them in terms of design. for the most part they just know how to design a hardware that looks nice to the eye and touch. i just wish their product a bit more less expensive."
comment,,1778273232.0,1,,,,,1t6669v,okpkbmo,David Attenborough is older then sonny
comment,,1778293464.0,1,,,,,1t6669v,okr6e4l,Sony has been one brand I never betray when it comes to Consoles and TVs. I was contemplating an OLED LG C5 over a Sony OLED. Went to an BB outlet and found an open box OLED bravía 8 for $700 in excellent condition and immediately purchased. Picture looks marvelous but you fuckers are getting expensive. 
comment,,1778322902.0,1,,,,,1t6669v,okst7c3,"Happy birthday SONY!! The greatest company of the world who set standards, making countless amazing products for both consumers and professionals. There will never be another company like SONY."
comment,,1778419255.0,1,,,,,1t6669v,okzpzdh,As a kid growing up I was so fascinated. I am born in the 80’s - back then Sony was just special and different and so innovative. Good thing is we now have adult money. 
comment,,1778160212.0,28,,,,,1t6669v,okfyknl,"Same! I love Sony products, had almost all their ecosystem from Xperia phones, headphones, walkmans, headphone integrated amplifier, PS, Bravia TV and soundbar except Camaras. Probably about close to 100 Sony products at homes. 

I wish they could get their act together and be the Sony of the 1980/90s again, full of creativity, innovative and always give their best but nowadays they seem to be about maintaining their business only with no drive whatsoever. "
comment,,1778201836.0,2,,,,,1t6669v,okjy1d4,Like with most Japanese companies it’s just become extremely difficult to compete with China. That’s why they’re partnering with TCL for example
comment,,1778184449.0,1,,,,,1t6669v,okig6hg,rumours are ps6 will launch with handheld counterpart 
comment,,1778207028.0,1,,,,,1t6669v,okkbsuc,"And the phone, not using their own best camera sensor and removed their own feature to make it more like other brands. They want to sell it for music but without DACs.

 I loved their long phone perfect 1 hand size of 1V and still have not gotten used to the size change of 1VI after 1 year. "
comment,,1778178983.0,1,,,,,1t6669v,okhw5gm,I had hoped to be an Xperia phone user for the long term but I paid £1500 on the Xperia Pro-I when it was released and it fried itself (motherboard) after two years and Sony couldn't car less. I've never had a phone have such a short life. Shame.
comment,,1778178079.0,3,,,,,1t6669v,okhsvau,"""this spring"" they technically have 6 weeks left of spring, so before june 21st I guess."
comment,,1778194204.0,1,,,,,1t6669v,okjd8kt,"Lot of stuff should go on par with others, such as smartphones. Sony once was a guarantee (still today to some extent)"
comment,,1778166674.0,15,,,,,1t6669v,okglmwa,"I'm one of those fan of Sony, it's a shame how the product portfolio keeps shrinking... I changed (updated) from Vaio (13 years old) to new inzone setup (keyboard, mouse and M10s monitor)... but now I have to buy a mini PC and that's nos the Vaio experience I remember...

https://preview.redd.it/z137cmigeqzg1.jpeg?width=1706&format=pjpg&auto=webp&s=8c45107b7f7e4a1af31124350da486309582e2da"
comment,,1778160371.0,3,,,,,1t6669v,okfz3oj,"I envy you so much! (In the best ways possible!) my ultimate dream would be having a house with everything that can be Sony, being Sony….one man can dream! I hope whoever takes charge of the global company steers into the right direction."
comment,,1778245545.0,2,,,,,1t6669v,okms0o1,"Not possible unfortunately. The world has changed and where there was no competition there is now South Korea and China.

Looking at the fiscal year report, the Entertainment division (basically the stuff that we can buy as consumers minus the playstation) is one of their least profitable division (it's still doing well don't get me wrong).

We should simply hope that Sony doesn't exist the consumer market all together. I too would like to see Xperias and Vaios everywhere like it's 2010 but it was actually incredibly difficult years for Sony .... They did what was necessary to survive"
comment,,1778210972.0,1,,,,,1t6669v,okklqgt,We don't even get the sony phone anymore here in india. Sony Ericsson was all the rage back in the 2000s. I think they had released Xperias back when it first launched but they've stopped now
comment,,1778161204.0,7,,,,,1t6669v,okg1vin,"Don't be lol. This brand can be a hell of an addiction if you are not careful haha. Plenty of stuff to wow and get you hooked. You will be lucky if they didn't burn you a hole in your pocket cos it is really addictive 🤦Stop before you sink further 😂 

My room is already full of their stuff haha, I mainly collect their classic headphones and old PS1 and PS2 consoles CIB. My audio setup is also completely in their ecosystem from walkmans to Xperia to their signature series headphones/IEMs and high end amplifier. I am also looking for the ES series players, speakers to complete the setup for classic package. I also want a 90s era setup fo retro games with the Trinitron TV.

On the audio/visual side, I am also thinking of getting the ES blu-ray player with their 2023 ES AVR to pair with the Bravia TV. 

Haha I am fully in their ecosystem already, I guess I might never be able to leave them now lol. "
comment,,1778274461.0,1,,,,,1t6669v,okpogc1,"Do you mean entertainment as in music, pictures and Playstation or home entertainment as in tvs and stuff. Cos if its the former then Sony is absolutely killing it"
comment,,1778161452.0,1,,,,,1t6669v,okg2pl9,"I can’t imagine how much worth of Sony products you have, but the numbers must be insane! "
comment,,1778167198.0,1,,,,,1t6669v,okgnl9n,"Just a question. If I get an Xperia phone and use it with my Xm4 headphones, Wil I notice any difference in sound quality? Any advantage using an Xperia with Sony headphones?
"
comment,,1778275050.0,1,,,,,1t6669v,okpqd81,"Yes the 2nd, sorry that wasn't clear"
comment,,1778164351.0,3,,,,,1t6669v,okgd1ph,"My prized hogs are:
- 2 sets of 10 million edition PS1 CIB (only 300 made in the whole world) 

- Signature series MDR Z1R, IER Z1R, TA-ZH1ES amplifier, NW-WM1ZM2 gold walkman

I had 30 CIB PlayStations and 60 plus headphones and of course the TV, soundbar, and the phone. I am constantly looking and adding to my set up. Plenty much to collect 💪

"
comment,,1778167668.0,3,,,,,1t6669v,okgpct7,"I used the Xperia 1vii with the XM6, it will definitely utilise LDAC on Android developer's mode, sounds miles better with DSEE Extreme on auto and ""priorities sound quality"" on your Sony sound connect app. 

This versus pairing the XM6 with an iphone on AAC are day and night difference for me. Iphone sound quality sounded too hollow for me after going back for testing. I guess my ears are getting too well fed by the Xperia sound haha"
comment,,1778197399.0,1,,,,,1t6669v,okjmkc2,Thanks for the feedback. I'm using an android phone that supports LDAC I've read somewhere online that DSEE extreme is best left turned off. 
post,"yesterday I went to Sony Store in Osaka,Japan",1777827637.0,732,1t2qyke,https://www.reddit.com/gallery/1t2qyke,21.0,Heaven 🥹🥰,,,
comment,,1777827637.0,1,,,,,1t2qyke,ojpnk4m,"**If your post DOES NOT show up unless you are logged in, kindly get in contact with the mods!**

In that case your post was caught in the spam filter and needs to be approved manually.

It is easiest to check that [by opening this URL](https://www.reddit.com/r/sony/new/) in a private browsing session (e.g. Incognito mode).

If your post is not there, [contact the mod team via this form](https://www.reddit.com/message/compose?to=%2Fr%2Fsony&subject=Post%20possibly%20held%20back%20by%20spam%20filter&message=Hello%20mod-team%20of%20r%2FSony%2C%20%0A%0AI%20suspect%20my%20post%20was%20mis-identified%20as%20spam.%20Therefore%20I%20request%20manual%20approval.).

*I am a bot, and this action was performed automatically. Please [contact the moderators of this subreddit](/message/compose/?to=/r/sony) if you have any questions or concerns.*"
comment,,1777853395.0,32,,,,,1t2qyke,ojrztn9,I miss the Sony store in the US.  They used to have it everywhere.  Metreon in San Francisco used to be the biggest with 4 floors of Sony and a AMC movie theater.
comment,,1777859457.0,15,,,,,1t2qyke,ojsh3n0,"I know these were money pits in the US and never turned a profit, but they were always a joy to visit. Sony on proper display is sadly hard to find these days."
comment,,1777848923.0,4,,,,,1t2qyke,ojrmzly,I wish the one in Berlin was still open 😔
comment,,1777854260.0,4,,,,,1t2qyke,ojs29ly,Reminds me of the Apple Store... But for Sony. 😊
comment,,1777858638.0,2,,,,,1t2qyke,ojserdp,Jealous! Wish I could purchase the Recon Pro here in the States...
comment,,1777861231.0,1,,,,,1t2qyke,ojsm04o,Awesome i miss my local sony store
comment,,1777873626.0,1,,,,,1t2qyke,ojtee6u,Are the phones like region locked or whatever I find them awesome but in Poland they cost fortune I heard in Japan they are cheaper 
comment,,1777875818.0,1,,,,,1t2qyke,ojtime2,Out of curiosity - was there something available only for Japan market? 
comment,,1777893970.0,1,,,,,1t2qyke,ojuhuqg,"There are still Sony stores in Hong Kong, though not as spacious "
comment,,1777941667.0,1,,,,,1t2qyke,ojyz9xy,Bought my PS Vita at the Sony store in Dallas back in 2011
comment,,1778091141.0,1,,,,,1t2qyke,okapnyd,Xperia ? I wanna go there this summer and buy one
comment,,1778095168.0,1,,,,,1t2qyke,okb4s2n,"Have been to the Ginza Sony store a number of times.  Aibo isn't a thing any more here in the States, but gosh darn it if it isn't the cutest thing.  They continue to refine it to this day."
comment,,1777878839.0,1,,,,,1t2qyke,ojto94b,They also have a Xbox Series X😅
comment,,1777883978.0,0,,,,,1t2qyke,ojtxhl6,Hmm.....so it's like a Best Buy from 2010?
comment,,1777856447.0,5,,,,,1t2qyke,ojs8jeg,Yeah me too but in Canada. The service was exemplary - unlike trying to get service and repairs done online nowadays.
comment,,1777865035.0,3,,,,,1t2qyke,ojsvrzw,I bought a lot of things at the Sony Store.  I miss it too.
comment,,1777854285.0,1,,,,,1t2qyke,ojs2c3z,Why was it closed? 🧐
comment,,1777854734.0,4,,,,,1t2qyke,ojs3mdu,"Sony sold the Sony Center and apparently did not want to rent the space for the shop from the new owner. I also think they did not continue to lease any office-spaces in the building.

https://www.sony.com/en/SonyInfo/News/Press/200802/08-031E/"
comment,,1777870627.0,1,,,,,1t2qyke,ojt8cy9,"Thanks. Makes sense, as that happened during the 2008 financial crisis."
post,GUIDE: How to get best sound from Sony WH-1000XM4,1626479254.0,700,olt1u6,https://www.reddit.com/r/sony/comments/olt1u6/guide_how_to_get_best_sound_from_sony_wh1000xm4/,145.0,"Hello all redditers!

As many of you know, XM4 are quite good sounding headphones once you start to tinker aroud in Sony Headphones app EQ setting. Still, this EQ gives us only a small range of frequencies and some are straight missing.

In this post I am going to lay down 2 ways how to get best sound from your headphones. One easy way, with mixed results and one with more steps but with ultimate sound at the end. But first we need to understand what we are aiming for!

# Harman target curve

We will be targeting Harman curve (2017-18 version) for best sound (or best starting point to some more personal adjustments). Harman curve is evolving sound curve that combines scientific data about our hearing and current trends in music. Curve looks like this:

[Harman 2017-2018 \(rough\) target curve](https://preview.redd.it/123o0li4dnb71.png?width=1649&format=png&auto=webp&s=d60c6c1f189ad7356cbda5c623e00a0b991dcc5b)

Ok. Now that we know what we are aiming at, let´s have a look what we are working with!

On this graph we see frequency responce from XM4. Dotted line is our rough target frequency.

[Sony WH-1000XM4 frequency responce](https://preview.redd.it/y77183fienb71.jpg?width=1200&format=pjpg&auto=webp&s=565e23b24850e17d13e23f7b4012c170fe095210)

As you can see, we are quite far from our ideal target curve. No worries, we will fix it!

# Option 1 - use Sony Headphones app

First option how to get close to our Harman target curve is to use tools, that Sony gave us. Sony Headphones app gives us some frequencies.

Andrew Park on [Headphones.com](https://Headphones.com) did fantastic job to target his Harman target curve and he came with **these setting in app**

* 400 Hz : +0
* 1 kHz: +4
* 2.5 kHz: +6
* 6.3 kHz: +0
* 16 kHz: +0
* Clear bass: -1

His final curve after these changes looks like this:

[Frequency responce after EQ settings in Sony Headphones app](https://preview.redd.it/wc0eccthhnb71.jpg?width=1599&format=pjpg&auto=webp&s=6add76159f89511dd23f0c7eeb0b22f8d809a9d9)

We can see that we got much closer to our target, but we are still far from our target at some frequencies. Most notable areas are 100-300 Hz and 7 kHz.

That **100-300 Hz area is our biggest problem**, because there is no slider in EQ settings. This over the top curve in this are **makes bass parts more ""muddy"" and with less punch.**

**Here is my own setting for more punchy bass and less muddiness**. I´ve also tried to correct spike in 7 KHz range. I would suggest to try both previous and mine EQ setting on custom slots in EQ.

[Experimental EQ settings](https://preview.redd.it/kbwk2xrmjnb71.png?width=689&format=png&auto=webp&s=db66ca1dcaa0bfd809e917af9856770f040b5c75)

# Option 2 - Poweramp

Poweramp is one of the best apps when it comes to sound and music quality. First of all it has its own decoder, that is one of the best on mobile market and also it has its own controlled sound pipeline with option for Hi-Res Output at the end. Aaaand poweamp has super detailed EQ settings for fine tuning.

Poweramp comes as 14 day trial, so this will give you plenty of time to compare final sound quality at the end of this guide. Spoiler alert! It is worth it!

(Optional step)

>!First we need to enable Hi-Res Output audio. Best guide can be found here. http://casediletanta.blogspot.com/2021/01/poweramp-music-player-build-893.html!<

Now we need some good baseline to EQ on. I suggest using (again) Andrew Parks EQ setting in Sony Headphones app. This will give us good audio outside Poweramp but also good starting point for further EQ in poweramp because we know frequency responce on this setting.

Lets head to Poweramp than. **First we need to have wider range of EQ frequencies**. We can do that by going into Settings--> Sound --> Equalizer --> Equalizer Bands --> Number of bands --> 16. Now we have 16 EQ bands to work with!

Open Poweamp EQ settings. Now, **just copy these setting on every individual slider**:

[Poweramp EQ setting - smoother option](https://preview.redd.it/oyduipuzrnb71.png?width=1764&format=png&auto=webp&s=bcd7bea77eb8093d8be94e92c56cad7ea8530b9a)

Now **you need to SAVE THIS EQ PRESET.** You can also bind it to specific headphones (XM4).

This is what i call smoother option. It has lots of clarity in highs and mids, but more smoother take on bass. It still has punch, but not to the point it becomes unpleasant after hours of listening.

I also use this ""punchy"" option, with empsasis on punchy, short bass:

[Poweramp EQ setting - \\""punchy\\"" option](https://preview.redd.it/zv9eky98vnb71.jpg?width=1835&format=pjpg&auto=webp&s=da6276a20d728550c20eb3cbfedd61ee805f0d9f)

&#x200B;

Well, we are at the end of our jorney. Every person is different, every ear is different so feel free to experiment! I think that these settings are good starting point for that!

Hope you liked this guide. Sorry for my bad grammar, but English is not my first language.",,,
comment,,1653329606.0,28,,,,,olt1u6,i9pmc3g,"I know this is an old post, but just wanted to drop my sony app EQ settings for OP if you're still around, and anyone else that finds this thread.  

Just got my XM4s this weekend, and I've been trying to emulate the sound of my DT1990 Pro's (with Dekoni Audio Elite Velour pads, and an inline passive filter from diy-audio-heaven), aiming for mostly reductive EQ.  

400:  -4  
1k: +1  
2.5k: -1  
6.3k: -2  
16k: +1  

Clear Bass:  -4

This was all done by ear - furiously swapping cans repeatedly - but has ended up pretty damn close to my Beyers as far as I can tell.  It's not perfect, but a marked improvement from stock, and I prefer it to Lauren Dragan's effort posted elsewhere in this thread."
comment,,1667554700.0,10,,,,,olt1u6,iv08tsb,"Hi, for reference, I used AutoEQ ([https://github.com/jaakkopasanen/AutoEq](https://github.com/jaakkopasanen/AutoEq)), with oratory1990 measurements and the following equalizer definition:

    filter_defaults:
      type: PEAKING
      q: 1.05
    filters:
      - fc: 400
        type: LOW_SHELF
      - fc: 1000
      - fc: 2500
      - fc: 6300
      - fc: 16000

(same as the one proposed by AutoEQ for the Sony app, except for the LOW\_SHELF type, that I use to work around the ""no band below 400"" issue)

This produces the following results:

[https://imgur.com/a/HjSxaHs](https://imgur.com/a/HjSxaHs)

|\#|Type|Fc (Hz)|Q|Gain (dB)|
|:-|:-|:-|:-|:-|
|1|LowShelf|400|1.05|\-4.7|
|2|Peaking|1000|1.05|0.7|
|3|Peaking|2500|1.05|5.3|
|4|Peaking|6300|1.05|\-1.4|
|5|Peaking|16000|1.05|\-2.4|

And after shifting the whole range by 4.7 and rounding, I get the following settings for the app (leaving clear bass at 0):

[https://imgur.com/a/XLTmsnI](https://imgur.com/a/XLTmsnI)

\[0, 5, 10, 3, 2\]"
comment,,1626509844.0,6,,,,,olt1u6,h5hvco2,"This is pretty neat! Here's a custom setting:

400 Hz: +1

1 kHz: +4

2.5 kHz: +5

6.3 kHz: +4

16 kHz: +0

Clear Bass: +2"
comment,,1626492756.0,5,,,,,olt1u6,h5h8dof,[deleted]
comment,,1626510151.0,3,,,,,olt1u6,h5hvozu,"Saving this. I LOVE my XM4. I had the CHX0007 Or whatever and those started my addiction. When I saw these go on sale for $250, it was a done deal."
comment,,1626510985.0,6,,,,,olt1u6,h5hwm27,"I also use this EQ curve. Note though that the Harman curve you've shown in the first image is for IEMs not headphones. 

Other options include Sonarworks Sound ID (paid), which is very similar to Harman. Or a free alternative called Wavelet. While more accurate than the Sony EQ, they do not work with all audio streams on phones. Which is why I use the Sony EQ with settings very similar to headphones.com (but less bass)."
comment,,1641489796.0,4,,,,,olt1u6,hrikerk,Any love for iOS users ?
comment,,1632149143.0,3,,,,,olt1u6,hdlh47a,"Hey! Thank you very much for this tutorial, exactly what I was looking for. I have one question though, there is one more article regarding the same topic, where they also describe a near Harman target curve preset, yet it's quite different from Andrew's, how is it possible?

you can check it out here: https://hometheaterreview.com/sony-wh-1000xm4-wireless-noise-canceling-headphone-review/"
comment,,1636080991.0,3,,,,,olt1u6,hjdc2en,"Dude your more punchy version is beautiful. Nice job, I’m stealing 🙏🏾"
comment,,1629069981.0,2,,,,,olt1u6,h93ase0,"Will the poweramp configuration stay in my xm4s even if I connect them to another device, say, my laptop?"
comment,,1658340032.0,2,,,,,olt1u6,igy2n8o,"I love this post, thank you! 
But P.S., if you want Harman curve on the whxm4(or any headphones/speakers for that matter) without the need to find the frequency response curve and put in all the values, you can just get the Wavelet app since it already used the Autoeq database to get all the headphone data."
comment,,1662808451.0,2,,,,,olt1u6,inucevb,"I'm super late to the party but damn, just wanted to say thanks for sharing this. It really made my Sony's sound much better than before!! I'm now using the PowerAmp app and the difference is really insane 😂

After listening to my (yes unbelievably) Samsung Galaxy Buds 2, I just preferred them over my Sony WHXM4's because Akg really tuned those earbuds pretty well when. It created a contrast that made me pick my earbuds over my headphones xd. 

Whelp I'm glad that I followed this guide😊😊"
comment,,1710277929.0,1,,,,,olt1u6,kukvzny,Best EQ! Not fatiguing at all after long session listening
comment,,1721083124.0,1,,,,,olt1u6,ldd46b8,Hi. Can someone explain.. do I need to disable Sony equaliser to use Poweramp?  Is there a video of how to get most out of all the various settings in Poweramp which are very extensive. Or is there a post with great Poweramp settings.Many thanks. 
comment,,1724226122.0,1,,,,,olt1u6,lj6cf7d,"I’m late to the party here. I will never understand why people ADD bass to these headphones. Out of the box they are muddy and lack clarity. I used AutoEq with Oratory1990’s measurements and the difference is outstanding across all genres. 

Thank you for the options within the Sony Headphone Connect app. I have struggled to mimic the listening experience I have at home while on the move."
comment,,1728530823.0,1,,,,,olt1u6,lr77brc,Sick
comment,,1728824180.0,1,,,,,olt1u6,lrpo3fh,"I tried this a year or so ago when I bought them, I was struggling so much with finding something great.

I absolutely love both those setups but I actually forgot to come back here and say it, and I bumped into this again and I'm now able to.

Thank you very much."
comment,,1731975796.0,1,,,,,olt1u6,lxui1yh,This is amazing bro
comment,,1732669065.0,1,,,,,olt1u6,lz63hyx,https://preview.redd.it/89d6abjpec3e1.jpeg?width=1440&format=pjpg&auto=webp&s=c5861990c9daabf516c03cc91fd842b2082cb29d
comment,,1733002805.0,1,,,,,olt1u6,lzrwvfs,"Thank you so much! I was very disappointed as the Sonys sounded very muffled and 2 dimensional. Tried some other eqs here on reddit, but your EQ is by far the best, very balanced and non fatiguing."
comment,,1734396151.0,1,,,,,olt1u6,m2f40kl,"Hey a bit late but after using an eq from here for ages I want to contribute mine thats based on my Beyer DT770 pros with a SonarWorks SoundID curve applied to it. Should be pretty close to a flat response

400hz -4

1k hz -2

2.5k hz +1

6.3k hz -2

16k hz -2

Clearbass -9"
comment,,1734919065.0,1,,,,,olt1u6,m3djnd6,Thank you for your article. PowerAMP really is very reliable tool to cut-off Sony's dull midbass overemphasis and make bass more punchy.
comment,,1737670434.0,1,,,,,olt1u6,m8szydg,I would like to say thanks. It's the most useful tip on Reddit
comment,,1738410758.0,1,,,,,olt1u6,mad2oj5,Good stuff 🔥
comment,,1738984601.0,1,,,,,olt1u6,mblkrte,"I literally picked up some brand new XM4’s today for $112 (going out of business store)! I have a new Apple phone. I see some great settings (u/3_50) but I want to make sure I have all the settings correct. Do I turn off the Apple Music equalizer? Any tips would be appreciated. As for my music taste. Rock mostly. Pearl Jam, Springsteen, Sturgill Simpson and stuff like that. Thanks in advance."
comment,,1741714047.0,1,,,,,olt1u6,mh8j6f6,"Digging up this long-defunct post to thank you, OP. I use my XM4 whenever I'm in a noisy environment, and since I've had it (several years) I've been alternating between the Andrew Park EQ and the ""bright"" setting, neither of which I like that much (though I find both more listenable than the tuning out of the box). I like this manual EQ setting far better than either."
comment,,1744182761.0,1,,,,,olt1u6,mm69sq8,.
comment,,1747760384.0,1,,,,,olt1u6,mtbpkez,"Hello there !

Just another comment to say : THANK YOU.
I have recently purchased an XM4, and I was rather satisfied with my current setting, but I thought I could give a try to a more neutral sound.

So here I am 2 weeks after the purchase, rediscovering my earphones and being completely amazed by most of my favorite musics. Thanks to you !
This is really a game changer."
comment,,1748366807.0,1,,,,,olt1u6,mujt8un,"Joining very late, but this is a great post. 


The actual improvement in my knowledge in this area from 5 minutes is great. Even just copying the EQ dramatically improves the sound from the generic manual EQ. 


Bravo, great post."
comment,,1749537480.0,1,,,,,olt1u6,mwz2by8,"Thanks for this post. I tend to think almost any EQ sounds good until I compare it to another, and then decide it sounded bad. It's so hard to know what is the right sound. I tried several in this thread, and they all sounded good until I tried the next one. For now I think Andrew Park's (but with clearbass on +3) is working for me. I had tried Andrew Park's EQ when I first got this headphone, but I liked Oratory1990's EQ (via Wavelet app) better. I am currently trying to get away from apps like wavelet, and use just the Sony app which can store the EQ directly onto the headphone. I think I'll leave it on this EQ for a little bit and see how it goes. When I first heard the XM4 on default sound it was way too boomy and muddy, I don't know why it gets such good reviews for sound. Luckily it is capable of being much better with EQ.

  
Okay, now I'm trying the Andrew Park EQ with 400 set to -1 and clearbass on +3."
comment,,1759831997.0,1,,,,,olt1u6,ni7zijk,"EQs will forever be one of the most mysterious things on planet earth to me. how one can sound so much better or worse to different people is so interesting.
I made an EQ for what I prefer, I mostly listen to cello and double bass, bluegrass and country, and glitch trap. so the most important thing for me is the separation of elements and clear sweeping bass.


My settings are as follows:
0, -3, +2, +3, 0, +4 bass"
