Type,Title,Time Stamp,Score,Id,Url,Num Comments,Post Text,Post Id,Comment Id,Comment Text
post,Every time I empty my Dyson,1715956937.0,1508,1cu6ycr,https://i.redd.it/yruekxjy001d1.gif,53.0,It’s like scattering Donnie’s ashes…,,,
comment,,1715964545.0,16,,,,,1cu6ycr,l4h8xl0,This made me laugh so much. Thanks OP.
comment,,1715975002.0,13,,,,,1cu6ycr,l4i2jhb,"That’s just, like, your opinion man."
comment,,1715993811.0,8,,,,,1cu6ycr,l4jd6xm,"Lmaooo. That was literally me with my mom's ashes and my 11 yo son. Omg even then, I couldn't help but laugh as I brushed Nanny off his shirt & out of his hair with my hands. Lollll"
comment,,1715959510.0,4,,,,,1cu6ycr,l4gue2u,Shut the fuck up Donnie!
comment,,1715963033.0,10,,,,,1cu6ycr,l4h4m0z,"I just want my bag back, man."
comment,,1715969491.0,3,,,,,1cu6ycr,l4hn2dk,Best movie ever!!
comment,,1715981018.0,3,,,,,1cu6ycr,l4iiuua,It’s one of the gripes of bagless vacuums. I generally take it outside to the waste bin rather than risk this happening in my home.
comment,,1715990493.0,3,,,,,1cu6ycr,l4j5oz9,"Everything is a travesty with you, man!"
comment,,1715962793.0,2,,,,,1cu6ycr,l4h3xcr,Literally lol
comment,,1715968107.0,2,,,,,1cu6ycr,l4hj498,Every vacuum I’ve ever had for me
comment,,1716024256.0,2,,,,,1cu6ycr,l4ktbnw,My dad was scattering his father’s ashes at a coastal spot in the UK and it blew right back in his face. It was fucking hilarious.
comment,,1716077278.0,2,,,,,1cu6ycr,l4o5371,I only empty it before I shower.
comment,,1715970616.0,1,,,,,1cu6ycr,l4hq93q,Don’t go for an outside slash then.
comment,,1715975301.0,1,,,,,1cu6ycr,l4i3d6t,"The story is ludicrous, you’ll never guess what happens next."
comment,,1715976776.0,1,,,,,1cu6ycr,l4i7h27,Hilarious! 😂
comment,,1715991648.0,1,,,,,1cu6ycr,l4j8bbv,"Obviously, you're not a golfer."
comment,,1716001519.0,1,,,,,1cu6ycr,l4jttjx,Just because we’re bereaved doesn’t make us saps
comment,,1716009908.0,1,,,,,1cu6ycr,l4k8npj,Every f time!
comment,,1716011370.0,1,,,,,1cu6ycr,l4kb2zc,Too true.
comment,,1716013959.0,1,,,,,1cu6ycr,l4kf6nw,This is why I only use my Samsung with the auto-empty dock station now
comment,,1716016132.0,1,,,,,1cu6ycr,l4kie76,Our Dyson handheld is a pain in the arsenal because of this. Its very handy vac but fuck my life I hate emptying it and that tit convinced millions of us that it was the best idea ever.
comment,,1716018677.0,1,,,,,1cu6ycr,l4km096,🤣
comment,,1716028498.0,1,,,,,1cu6ycr,l4kzfdd,This is the kind of post and laugh I didn’t know I needed 😂
comment,,1716056590.0,1,,,,,1cu6ycr,l4mrq24,😂 So true
comment,,1716057971.0,1,,,,,1cu6ycr,l4mv9rc,I do that purposefully.  But I'm a nihilist.
comment,,1716061657.0,1,,,,,1cu6ycr,l4n4gxd,"I'd probably have this problem too if my brand new Gen5 Detect Absolute didn't spontaneously stop operating after 10 minutes of use on a full charge that completely streaked up my living room hardwood floor AS A FIRST TIME DYSON USER.

Ain't nobody got time for that. I'm leaving for UPS in 15 minutes to return this crap stick."
comment,,1716067341.0,1,,,,,1cu6ycr,l4ni91n,Yup! I felt this!
comment,,1716070867.0,1,,,,,1cu6ycr,l4nqj8h,🤣🤣🤣
comment,,1716079055.0,1,,,,,1cu6ycr,l4o927r,"Everything's a fucking travesty with you, man!"
comment,,1716083816.0,1,,,,,1cu6ycr,l4ojhbc,"Gawd, even though I expected that to happen in that scene, i still nearly passed out laughing at it!

“STFU Donnie, you’re out of your element!”"
comment,,1716222233.0,1,,,,,1cu6ycr,l4w6q9p,Facts
comment,,1717372047.0,1,,,,,1cu6ycr,l6u6mzt,I will shove it in the garbage can literally lmao 😂
comment,,1718523792.0,1,,,,,1cu6ycr,l8tz8ah,That's why Samsung made the Clean Station to empty the container without making a mess
comment,,1718933402.0,1,,,,,1cu6ycr,l9jxm4s,Time for an auto empty stick!
comment,,1715964376.0,1,,,,,1cu6ycr,l4h8gan,🤣🤣 What film is this
comment,,1715978525.0,1,,,,,1cu6ycr,l4ic8ub,"as someone who is subscribed to r/VacuumCleaners and have used my parents dyson sticks a lot, I approve.

(Bags don't cost much extra per year, but provide so much sanity, washing filters and the bin is a weird aspect of bagless vacuums. Also paper bags of yesterday are weird, cloth bags are what the modern vacuums use and are great)"
comment,,1715987518.0,1,,,,,1cu6ycr,l4iys67,Bagged vacuum for the win
comment,,1715978722.0,4,,,,,1cu6ycr,l4ics2h,Same here. Literally busted up
comment,,1715980304.0,0,,,,,1cu6ycr,l4igzcy,[deleted]
comment,,1715972457.0,4,,,,,1cu6ycr,l4hvgoe,"There are some great bagged vacuums these days from brands like Sebo, Miele, Henry, Simplicity, etc. The premium ones get more expensive than Dyson but cheap and decent ones exist as well, like Kenmore Intuition."
comment,,1715992218.0,1,,,,,1cu6ycr,l4j9lok,Never will I go back to a bagged vacuum after owning a v11 torque drive for the past few years
comment,,1716066814.0,2,,,,,1cu6ycr,l4ngz9o,What was that shit about Nam?!
comment,,1715999401.0,1,,,,,1cu6ycr,l4jpgj7,He fixes the plumbing?
comment,,1715964500.0,8,,,,,1cu6ycr,l4h8t12,The big lebowski
comment,,1715974402.0,4,,,,,1cu6ycr,l4i0vpy,Holy Jesus drop what you are doing right now and go watch this movie.   I hope I never see someone ask this again.
comment,,1716006624.0,2,,,,,1cu6ycr,l4k394p,Saaaame
comment,,1716083880.0,1,,,,,1cu6ycr,l4ojmbv,“… you’re out of your element!”
comment,,1715973535.0,3,,,,,1cu6ycr,l4hyhg3,"Well it's this bag I had, really tied the room together."
comment,,1716169654.0,1,,,,,1cu6ycr,l4tgki6,Small chance you're autistic
comment,,1716025843.0,1,,,,,1cu6ycr,l4kvjkh,"Don’t be fatuous, Jeffrey"
comment,,1715980379.0,3,,,,,1cu6ycr,l4ih6el,[deleted]
comment,,1715978145.0,2,,,,,1cu6ycr,l4ib81o,Absolute A+ recovery.
comment,,1716819942.0,1,,,,,1cu6ycr,l5vx3ar,That rug that I vacuumed with my Dyson really pulled the room together.
comment,,1715980798.0,1,,,,,1cu6ycr,l4iia1q,Yeah we can't all be perfect lol. I feel sorry for people who don't know what life was like before smart phones.
post,Huge salute to 20 solid years of service old friend. 🫡,1716516490.0,583,1cz9yne,https://i.redd.it/gqxl58dt8a2d1.jpeg,109.0,,,,
comment,,1716517126.0,16,,,,,1cz9yne,l5eyc0w,Is your DC25 still running good?
comment,,1716517248.0,12,,,,,1cz9yne,l5eylvx,Niiiice! The hair is gonna be so much easier to deal with.
comment,,1716524846.0,9,,,,,1cz9yne,l5fe3ri,2008 was 20 years ago? Damn I'm getting old lol. Nice upgrade! Huge step up from the 25.
comment,,1716561951.0,4,,,,,1cz9yne,l5h7qnd,The dc25 isn't actually 20 years old yet it came in 2008
comment,,1716530615.0,3,,,,,1cz9yne,l5fnm07,"I have that left one and my mother bought it but never used it, when she passed I kept it and it's honestly really good"
comment,,1716572027.0,3,,,,,1cz9yne,l5i0avg,Why does the new one look like its been sat in a cupboard for the past year collecting dust?
comment,,1716534171.0,2,,,,,1cz9yne,l5fstmm,I really respect people who use things for AGES ! You deserve a nice new one 🤗🤗🤗
comment,,1716537722.0,2,,,,,1cz9yne,l5fxmrn,this might interest r/Wellworn
comment,,1716538190.0,2,,,,,1cz9yne,l5fy942,"damn, that dyson has been working longer than ive had a consciousness"
comment,,1716540320.0,2,,,,,1cz9yne,l5g12ef,I love that the stickers are still mostly in tact.
comment,,1716547868.0,2,,,,,1cz9yne,l5gbtek,My Dyson has made it 13 years so far! Hope it has another 12 left in it.
comment,,1716551725.0,2,,,,,1cz9yne,l5giwsh,"Good going. My DC07 is still going strong. It's had a new motor and a new bin catch mechanism and it needs a new hose, but it still works great!"
comment,,1716557277.0,2,,,,,1cz9yne,l5gvdlt,"Looking forwards to hearing how long the new one will last. I feel that the quality has gone down in the recent years, so fingers crossed it'll last for another 20"
comment,,1716560192.0,2,,,,,1cz9yne,l5h2xqw,Haha holy shit it's hard to believe mine is that old. Regular filter washes and she still sucks.
comment,,1716563528.0,2,,,,,1cz9yne,l5hc5kt,"I recently sold my DC22 after 16 years, still functional. My v6 is now 9 years old and I bought a Gen5 this year."
comment,,1716566083.0,2,,,,,1cz9yne,l5hjf52,Hold on to your old one 😉 just saying
comment,,1716572983.0,2,,,,,1cz9yne,l5i307v,Holy cow!
comment,,1716576400.0,2,,,,,1cz9yne,l5icji7,My DC28 Air Muscle lasted 15 years!! The OG Dyson’s were solid hopefully the new ones can live up to them
comment,,1716579400.0,2,,,,,1cz9yne,l5ikpor,[removed]
comment,,1716583345.0,2,,,,,1cz9yne,l5ivaaj,I made the same upgrade! Such an improvement in how much it picks up!!!
comment,,1716584362.0,2,,,,,1cz9yne,l5ixz9s,"Dam, thats great, I couldn't even get 2 years out of a Dyson fan before it self destructed. (The internals literally fired, the tech notes say the entire board was burnt.) They fixed it under warranty, but dam I am little hesitant now."
comment,,1716587365.0,2,,,,,1cz9yne,l5j5mln,Just moved (far) and picked up a V12 to replace my yellow upright of many many years that I left behind. Love it!
comment,,1716587504.0,2,,,,,1cz9yne,l5j5yye,"We love our old DC23 so much.

But we HATED the DC47. I hope this works out."
comment,,1716593949.0,2,,,,,1cz9yne,l5jl7rp,The old one is better.
comment,,1716601617.0,2,,,,,1cz9yne,l5k2bf2,Here’s hoping the new one lasts 3 years.
comment,,1716607352.0,2,,,,,1cz9yne,l5ker46,There’s a reason I buy Dyson and no other vacuum brand.
comment,,1716632925.0,2,,,,,1cz9yne,l5lfzx6,"I have a dc04, got it in 2020.,still.going strong , and it hasn't stopped sucking"
comment,,1716639596.0,2,,,,,1cz9yne,l5lqk9c,Do you find the animal 3 hard to push? I just got one and it’s hard for my wife to push around.
comment,,1716649182.0,2,,,,,1cz9yne,l5mbav7,The gears blew up in my Dyson years ago. I still use it to clean the basement floor. I replaced it with a much cheaper Shark that’s lasted far longer. YMMV
comment,,1716706039.0,2,,,,,1cz9yne,l5pq0ai,This is some bullshit. Dyson vacuums fall apart and don’t last. Overpriced ugly colored planned obsolescent crap
comment,,1716745281.0,2,,,,,1cz9yne,l5rsxt3,Should’ve gotten a wired model. My wireless is less than 3 months old and constantly in charging state. Plus the display is already bugged and won’t confirm my changes.
comment,,1716780966.0,2,,,,,1cz9yne,l5u4ztr,They do last long. I replaced mine when it started running bad after 18 years. Hoover and other cheap crap only lasts under 5 years.
comment,,1716541949.0,4,,,,,1cz9yne,l5g37ds,Older Dyson tech is so much better made than new Dyson.
comment,,1716532568.0,2,,,,,1cz9yne,l5fqixu,20 years that's it? I still have the vacuum my parents got as a wedding gift in like 1985 because it still works amazingly
comment,,1716541266.0,2,,,,,1cz9yne,l5g2b0n,"You'll be lucky if the new one makes it to 5. 

I went through a big ball animal, and a cyclone v10 in the past 4 years, then just abandoned the brand altogether. The big ball heads are made of flimsy plastic, and the battery on the V10 stopped holding a charge."
comment,,1716546628.0,2,,,,,1cz9yne,l5g9tiw,[removed]
comment,,1716555070.0,2,,,,,1cz9yne,l5gq2u8,"Mine died literally a week before an extended warranty ran out. It was just after Dyson came over all brexity so I had zero intention of buying another but wanted to cost them the maximum amount of £s, so made them fix it anyway even though I was about to buy another brand. 

They were ok at the start when made in the UK. Wouldn’t have one, now."
comment,,1716554780.0,1,,,,,1cz9yne,l5gpf0t,"I still have my dyson from childhood. Its yellow, and doesnt have the fancy ball thingy. I think this model came out right after we got ours."
comment,,1716556014.0,1,,,,,1cz9yne,l5gsatz,Sorry to be that guy but my animal 2 that I 'upgraded' to a couple of years ago was a complete downgrade from the dc25. Just didn't seem to have the lift.
comment,,1716557028.0,1,,,,,1cz9yne,l5gur1m,I bought a shark three years ago that’s already packed in
comment,,1716562605.0,2,,,,,1cz9yne,l5h9ksq,nice. I have a DC24 that I have used for the last 15 years. I still works wonderfully and i prefer it to my V10 by a mile outside of weight.
comment,,1716570755.0,1,,,,,1cz9yne,l5hwpk1,The iPhone of vacuum cleaners
comment,,1716571738.0,1,,,,,1cz9yne,l5hzhj2,Now the new one is gonna last about 5 to 7 years max because that’s just how stuff is made nowadays…
comment,,1716571834.0,1,,,,,1cz9yne,l5hzr8j,"Honestly I like the design of the old one better, something about exterior tubes is kinda good looking lol."
comment,,1716519960.0,1,,,,,1cz9yne,l5f4lku,Interesting
comment,,1716561045.0,1,,,,,1cz9yne,l5h599i,"Wow good for you my battery operated Dyson died twice, batteries were garbage."
comment,,1716562957.0,1,,,,,1cz9yne,l5hak8h,no innovation in design for over 20 years
comment,,1716569647.0,1,,,,,1cz9yne,l5htksq,Dyson are not very strong vacuums though. I like to spend a few more hundred dollars and get a better machine.
comment,,1716517271.0,13,,,,,1cz9yne,l5eyns2,It is not. One of the drive wheels for the motor for the brush auger began eating it's way through the plastic housing somehow. The auger didn't want to spin anymore.
comment,,1716531369.0,3,,,,,1cz9yne,l5foqzw,I’ve got a DC25. Had it since new. Have had to replace exactly 0 parts and it’s still running perfect. Recently took it apart all the way to do a good annual deep clean
comment,,1716548268.0,2,,,,,1cz9yne,l5gchlk,"I purchased a dc25 factory refurbished model off of woot, it's still a beast."
comment,,1716517333.0,7,,,,,1cz9yne,l5eystz,Oh my god yes! I used it already in my bedroom and the amount of shit I picked up was staggering after one pass.
comment,,1716582980.0,-2,,,,,1cz9yne,l5iub27,You can’t do basic maths.
comment,,1716562206.0,3,,,,,1cz9yne,l5h8g5p,Cheers anyways!
comment,,1716575543.0,2,,,,,1cz9yne,l5ia655,"That is because prior to the picture, I used it all around the house picking up everything that the old one wasn't getting"
comment,,1716551797.0,1,,,,,1cz9yne,l5gj21j,That's fantastic! Cheers to many more years!
comment,,1716557438.0,2,,,,,1cz9yne,l5gvs1d,"I hope so too!! Quality does feel iffy on the new one, but we'll hope for the best!"
comment,,1716560220.0,1,,,,,1cz9yne,l5h30h0,Haha!!!!
comment,,1716561680.0,1,,,,,1cz9yne,l5h6zld,👀
comment,,1716563554.0,2,,,,,1cz9yne,l5hc86b,Nice!! How you like it?
comment,,1716566118.0,1,,,,,1cz9yne,l5hjit3,Possibly... Cheers!
comment,,1716576425.0,1,,,,,1cz9yne,l5icly3,I'm hoping!!!
comment,,1716579793.0,1,,,,,1cz9yne,l5ilrzs,Whoa that's awesome!
comment,,1716583614.0,1,,,,,1cz9yne,l5ivzxv,Oh my god yes there is!! I can't believe how much the old one was missing!
comment,,1716584428.0,1,,,,,1cz9yne,l5iy5k0,Ah don't be... Cheers!
comment,,1716587422.0,1,,,,,1cz9yne,l5j5rqp,Fantastic!! Cheers!
comment,,1716587550.0,1,,,,,1cz9yne,l5j637p,That's awesome!! Cheers!
comment,,1716594013.0,1,,,,,1cz9yne,l5jlcwn,It isn't right now because the old one isn't working. I did love the old one though. I'm happy to have the new one though! Cheers!
comment,,1716645627.0,1,,,,,1cz9yne,l5m2r8l,That's fantastic!! Cheers!!
comment,,1716645596.0,1,,,,,1cz9yne,l5m2op0,"A little bit at first, but I was so excited it just started to  flow. 😂"
comment,,1716745906.0,1,,,,,1cz9yne,l5rul8a,Damn that sucks. Yes go plugged in next time haha.
comment,,1716783216.0,1,,,,,1cz9yne,l5u98qp,Hell ya!! Cheers to that!!!
comment,,1716549248.0,3,,,,,1cz9yne,l5ge6wk,Good thing this one doesn’t have a battery!
comment,,1716555432.0,2,,,,,1cz9yne,l5gqxek,"That’s just old battery tech, batteries haven’t changed in years. That’s just something that’s going to happen. Something you are using everyday depleting the battery and recharging every single day is going to kill the battery. Nothing to do with the quality of the vacuum, although yes things are made way cheaper."
comment,,1716550339.0,2,,,,,1cz9yne,l5gg772,The new want is quite frustrating to get back in the holster.
comment,,1716578978.0,1,,,,,1cz9yne,l5ijklp,They changed to be made on Malaysia back in 2002 before the dc25 was launched. They moved head office over more recently.
comment,,1716554823.0,1,,,,,1cz9yne,l5gpii2,Cheers to that!!!
comment,,1716557082.0,1,,,,,1cz9yne,l5guvze,Ah that sucks! Cheers!!
comment,,1716562648.0,1,,,,,1cz9yne,l5h9p59,Awesome to hear!! Cheers!
comment,,1716561372.0,2,,,,,1cz9yne,l5h6555,"I never got into the battery operated stuff. I like my cord to plug into the wall., 😂"
comment,,1716563055.0,2,,,,,1cz9yne,l5hatzj,"🤷🏻‍♂️Maybe they are taking the, don't fix what isn't broken approach? Hahah"
comment,,1716581596.0,1,,,,,1cz9yne,l5iqluk,You need glasses if you don't see improvements in their overall design over a period of 20 years.
comment,,1716569818.0,1,,,,,1cz9yne,l5hu26b,Right on!! Cheers!
comment,,1716517413.0,7,,,,,1cz9yne,l5eyzj0,Well damn that sucks.  I think they still have replacement power heads for the DC25.  That way you'd have a vacuum for the upstairs or a finished basement.
comment,,1716675809.0,1,,,,,1cz9yne,l5o4sm7,Wow..Rocking a dc07 original refurbished off of woot still works too
comment,,1716517995.0,3,,,,,1cz9yne,l5f0aku,"My dc43 always get tangled up right away- but I only use it for large carpeted areas.

My v15 does soo much better with hair (and tighter spaces)"
comment,,1716592061.0,2,,,,,1cz9yne,l5jgwpu,Last I checked 2024-2008 is 16 years lol. So yeah I can do basic math. That's why there was the question mark
comment,,1716563689.0,2,,,,,1cz9yne,l5hcloy,"Night and day. Makes the v6 look like it doesn’t do anything. Only downside is the weight, I’m a strong guy but it does get taxing on my wrist."
comment,,1716600618.0,2,,,,,1cz9yne,l5k03qz,Why not fix it?
comment,,1716558786.0,1,,,,,1cz9yne,l5gz7uv,"But there are ways to make batteries last longer, dyson has cheapened out on cell balancing in their packs. I had a 2014 dyson stick which kept working until 2021. I had a 2019 v10, who's battery died BEFORE the 2014 models one. Neither vac was used frequently on max power either."
comment,,1716517568.0,6,,,,,1cz9yne,l5ezc68,Nah. I got a 5 year warranty on it and it's going to be our main work horse. Thanks though! Didn't know they had replacement heads. I just went out and bought a new one. 😂
comment,,1716561588.0,2,,,,,1cz9yne,l5h6qlo,"I have x2, DC25 and still work as good as new. Have had them from approx. 2007 and 2009. Amazing vacuum. Extremely easy to repair if necessary and 3rd party parts are dirt cheap."
comment,,1716579591.0,1,,,,,1cz9yne,l5il86q,"Same, I've started using my V15 as my main vacuum for the whole house since it works so well and is so light. Helps I have hardwood floors."
comment,,1716564185.0,2,,,,,1cz9yne,l5he05n,Good to know! Cheers!
comment,,1716601062.0,1,,,,,1cz9yne,l5k12qr,I didn't fix it because I wanted a new one?
comment,,1716517806.0,3,,,,,1cz9yne,l5ezvl1,That DC25 will be good for another 20 years now lol
comment,,1716580990.0,1,,,,,1cz9yne,l5iozu8,"I think if I had all hardwood floors, I’d go for a try at the Tineco S5+ Steam. However, just my main level is laminate, so a quick go over with the v15 and a quick steam mop and that’s perfect for me"
comment,,1716601504.0,2,,,,,1cz9yne,l5k22go,!remind me 5 years
comment,,1716517837.0,2,,,,,1cz9yne,l5ezy0r,Cheers to that!!
comment,,1716585280.0,1,,,,,1cz9yne,l5j0c6n,"I like the Tineco, but I hear often that they don't last very long at all. Dyson has a dedicated mop coming out later this year I'll try out."
comment,,1716732311.0,1,,,,,1cz9yne,l5qv533,what do you use for steam mop on laminate?
comment,,1716601540.0,1,,,,,1cz9yne,l5k25cr,"I will be messaging you in 5 years on [**2029-05-25 01:45:04 UTC**](http://www.wolframalpha.com/input/?i=2029-05-25%2001:45:04%20UTC%20To%20Local%20Time) to remind you of [**this link**](https://www.reddit.com/r/dyson/comments/1cz9yne/huge_salute_to_20_solid_years_of_service_old/l5k22go/?context=3)

[**CLICK THIS LINK**](https://www.reddit.com/message/compose/?to=RemindMeBot&subject=Reminder&message=%5Bhttps%3A%2F%2Fwww.reddit.com%2Fr%2Fdyson%2Fcomments%2F1cz9yne%2Fhuge_salute_to_20_solid_years_of_service_old%2Fl5k22go%2F%5D%0A%0ARemindMe%21%202029-05-25%2001%3A45%3A04%20UTC) to send a PM to also be reminded and to reduce spam.

^(Parent commenter can ) [^(delete this message to hide from others.)](https://www.reddit.com/message/compose/?to=RemindMeBot&subject=Delete%20Comment&message=Delete%21%201cz9yne)

*****

|[^(Info)](https://www.reddit.com/r/RemindMeBot/comments/e1bko7/remindmebot_info_v21/)|[^(Custom)](https://www.reddit.com/message/compose/?to=RemindMeBot&subject=Reminder&message=%5BLink%20or%20message%20inside%20square%20brackets%5D%0A%0ARemindMe%21%20Time%20period%20here)|[^(Your Reminders)](https://www.reddit.com/message/compose/?to=RemindMeBot&subject=List%20Of%20Reminders&message=MyReminders%21)|[^(Feedback)](https://www.reddit.com/message/compose/?to=Watchful1&subject=RemindMeBot%20Feedback)|
|-|-|-|-|"
comment,,1716601552.0,1,,,,,1cz9yne,l5k26b2,"Haha will do, but I hope not. Cheers!"
comment,,1716589081.0,1,,,,,1cz9yne,l5j9v4r,"The reviews aren’t very good for the V15S, but those are only reviews! If that one came out 1 year earlier I would’ve picked it up for sure, but I’m not gonna go buy a 2nd V15 just to have the mop feature 😂"
comment,,1716749465.0,2,,,,,1cz9yne,l5s3vw5,I’m assuming which model is what you’re asking. I just have an old Hoover branded steam mop. 2 in 1.
comment,,1716593633.0,1,,,,,1cz9yne,l5jkhsj,"Oh, not the V15 mop. They're releasing a dedicated mop, not just the attachment.

Check out the [Dyson Wash G1](https://www.dyson.com/wet-cleaning/washg1)"
comment,,1716598620.0,1,,,,,1cz9yne,l5jvndc,Oh damn!! That’s definitely prototype in the photos but I’m interested in what they come up with! Wish it was steamed as well.
comment,,1716603247.0,1,,,,,1cz9yne,l5k5usu,"The real deal matches the prototypes. Already released in Japan I believe, and possibly also the UK. Lots of videos on YouTube 👍🏻"
post,Had enough of the dyson batteries failing. Got this attachment for $15 and threw on a dewalt battery.,1745787940.0,528,1k9eht1,https://i.redd.it/pj5fv12vzfxe1.jpeg,84.0,3 dyson batteries later i gave up and blught this attachment. Works like a champ and lasts way longer than the Factory batteries.,,,
comment,,1745789543.0,19,,,,,1k9eht1,mpdq37o,Last time I read about something like this the warning was that the lack of a decent BMS on the Dyson could cause it to wreck your battery by using it past the point it should have stopped. Put me off getting one as I know the wife or one of the kids would just run it to death. Is that an issue with this one?
comment,,1745797926.0,16,,,,,1k9eht1,mpeey77,Bro you got a lotta shit plugged into that outlet. Are you Ralphie's old man?
comment,,1745789852.0,14,,,,,1k9eht1,mpdr173,"Dyson batteries fail when people run on max or boost mode too often.

Same thing happens on nearly all power tool batteries when used on high demand loads."
comment,,1745789488.0,3,,,,,1k9eht1,mpdpx8e,How much more juice do you get from the dyson using a fully charged 5amp XR battery? 
comment,,1745793534.0,6,,,,,1k9eht1,mpe29fa,"I don’t get it. I’ve had my v15 for almost 2 years. Zero issues. Yet people have endless issues, lol."
comment,,1745788395.0,2,,,,,1k9eht1,mpdmjm9,Can I ask what and where did you get the attachment? Thanx.
comment,,1745841202.0,2,,,,,1k9eht1,mpgvbfj,"Just don’t let the dewalt battery drain to zero unless the adapter itself has a low voltage cutoff. If you’re not sure what I’m referring to, look into it before you fry your expensive dewalt batteries"
comment,,1745790329.0,1,,,,,1k9eht1,mpdshjs,I recently 3d printed myself one aswell. However most drill batteries are 20v (5s) and not 25v (6s). Also my drill batteries are 5s1p which will voltage sag a lot when going max power.
comment,,1745810416.0,1,,,,,1k9eht1,mpfbyo7,I replaced the battery in my V7 two years ago. No problem with my V10’s battery. I use the older one for the cars and vacuum up after my birds.
comment,,1745842180.0,1,,,,,1k9eht1,mpgxleb,Thank you sir.
comment,,1745925812.0,1,,,,,1k9eht1,mpn37fw,Lmao this is amazing
comment,,1745945460.0,1,,,,,1k9eht1,mporcpl,"I’ve had a V10 Animal since…. 2021 and the battery is still fine. Never heard of them going bad before now.





How long is a ’standard’ lifetime?"
comment,,1746017761.0,1,,,,,1k9eht1,mptza1y,"boat ad hoc shocking money boast cooing terrific beneficial repeat special

 *This post was mass deleted and anonymized with [Redact](https://redact.dev/home)*"
comment,,1746065736.0,1,,,,,1k9eht1,mpy9ryf,"I also had issues with Dyson and aftermarket batteries and got a Ryobi adapter.  Not only did I already have plenty of these batteries for my tools, I can also get more on sale if needed."
comment,,1746122425.0,1,,,,,1k9eht1,mq233uu,Thank God they did not make an EV. Quality is terrible.
comment,,1746192161.0,1,,,,,1k9eht1,mq6xqxy,"This is the way. I switched to my Makita batteries couple years ago, and it is the best thing ever"
comment,,1745792347.0,1,,,,,1k9eht1,mpdylmu,I done the same on a Dyson V7 except I use Makita...
comment,,1745862309.0,1,,,,,1k9eht1,mpiom4o,This is the way. I have a Makita adapter
comment,,1745883824.0,1,,,,,1k9eht1,mpkkwuy,Dyson closed their battery research facility in Ann Arbor a few years ago. I helped them tear down their X-ray diffractometer.
comment,,1745789875.0,-4,,,,,1k9eht1,mpdr3qm,I did this to my v8 but ryobi adaptor.  Threw dyson battery into trash
comment,,1745791498.0,14,,,,,1k9eht1,mpdw20v,"Willing to bet the adapter is just some garbage from Aliexpress resold on Amazon. Dewalt batteries are too expensive to risk using on a Dyson, especially with a family."
comment,,1745806623.0,3,,,,,1k9eht1,mpf2h82,Almost all modern power tool batteries have BMS built in. 
comment,,1745828263.0,2,,,,,1k9eht1,mpg8pjr,"The BMS in inside the battery, not the device."
